ticker,mcap_usd,price,name
KSS,1837079887.0,16.2,Kohl's Corporation Common Stock
GHRS,1834589976.0,26.76,GH Research PLC Ordinary Shares
CCS,1834330951.0,63.76,Century Communities Inc. Common Stock
MUJ,1829778393.0,12.3,Blackrock MuniHoldings New Jersey Quality Fund Inc. Common S
BXDC,1822187604.0,20.82,Blackstone Digital Infrastructure Trust Inc. Common Stock
MIY,1820852645.0,12.24,Blackrock MuniYield Michigan Quality Fund Inc. Common Stock
OZKAP,1820360364.0,16.09,Bank OZK 4.625% Series A Non-Cumulative Perpetual Preferred 
GEL,1818595122.0,14.85,Genesis Energy L.P. Common Units
TFIN,1814274541.0,76.21,Triumph Financial Inc. Common Stock
DRD,1809584170.0,20.93,DRDGOLD Limited American Depositary Shares
BHC,1809252916.0,4.84,Bausch Health Companies Inc. Common Stock
FLO,1808302252.0,8.53,Flowers Foods Inc. Common Stock
TH,1807476208.0,18.15,Target Hospitality Corp. Common Stock
PRG,1807357592.0,45.11,PROG Holdings Inc. Common Stock
MAZE,1804808961.0,32.61,Maze Therapeutics Inc. Common Stock
XNET,1804584782.0,5.67,Xunlei Limited American Depositary Shares
MESO,1804541462.0,13.98,Mesoblast Limited American Depositary Shares
QFIN,1804362921.0,14.82,Qfin Holdings Inc. American Depositary Shares
AESI,1803511727.0,14.44,Atlas Energy Solutions Inc. Common Stock
AGL,1802516239.0,108.04,agilon health inc. Common Stock
EPAC,1797825735.0,34.88,Enerpac Tool Group Corp. Common Stock
BRUN,1794638711.0,29.21,Boost Run Inc. Class A Common Stock
MAN,1782161345.0,38.32,ManpowerGroup Common Stock
JSM,1781804201.0,17.92,Navient Corporation 6% Senior Notes due December 15 2043
LINC,1776357596.0,56.0,Lincoln Educational Services Corporation Common Stock
SMA,1775980250.0,32.08,SmartStop Self Storage REIT Inc. Common Stock
PAX,1775332317.0,11.0,Patria Investments Limited Class A Common Shares
TRINZ,1774729398.0,25.24,Trinity Capital Inc. 7.875% Notes due 2029
FSUN,1773891638.0,37.95,FirstSun Capital Bancorp Common Stock
ZBIO,1772153892.0,28.07,Zenas BioPharma Inc. Common Stock
TRINI,1771213690.0,25.19,Trinity Capital Inc. 7.875% Notes Due 2029
GABC,1767401068.0,47.05,German American Bancorp Inc. Common Stock
CYD,1766362600.0,47.08,China Yuchai International Limited Common Stock
IIPR,1763875011.0,61.3,Innovative Industrial Properties Inc. Common Stock
IMKTA,1763779767.0,92.86,Ingles Markets Incorporated Class A Common Stock
MHD,1762835281.0,11.85,Blackrock MuniHoldings Fund Inc. Common Stock
WTFCN,1762578484.0,26.13,Wintrust Financial Corporation Depositary Shares Each Repres
CMRE,1756978219.0,14.57,Costamare Inc. Common Stock $0.0001 par value
APPN,1756752032.0,23.93,Appian Corporation Class A Common Stock
EVCM,1755350954.0,9.92,EverCommerce Inc. Common Stock
RXT,1748295830.0,7.01,Rackspace Technology Inc. Common Stock
PRLB,1742675856.0,73.24,Proto Labs Inc. Common stock
OPRA,1741434939.0,19.38,Opera Limited American Depositary Shares
VIR,1740471506.0,10.32,Vir Biotechnology Inc. Common Stock
STBA,1735704865.0,48.24,S&T Bancorp Inc. Common Stock
KMPR,1732374277.0,29.43,Kemper Corporation
EVTC,1731223565.0,28.09,Evertec Inc. Common Stock
FLOC,1731018171.0,19.16,Flowco Holdings Inc. Class A Common Stock
ALMR,1730353758.0,24.96,Alamar Biosciences Inc. Common Stock
RBCAA,1726360240.0,88.0,Republic Bancorp Inc. Class A Common Stock
INVX,1724563608.0,24.7,Innovex International Inc. Common Stock
TMC,1724133485.0,3.98,TMC the metals company Inc. Common Stock
KARO,1723846140.0,55.8,Karooooo Ltd. Ordinary Shares
WD,1723771611.0,50.21,Walker & Dunlop Inc Common Stock
DCOM,1722997142.0,39.26,Dime Commercial Bancshares Inc. Common Stock
BCAT,1720968525.0,15.91,BlackRock Capital Allocation Term Trust Common Shares of Ben
RLJ,1720604147.0,11.32,RLJ Lodging Trust Common Shares of Beneficial Interest $0.01
WKC,1719894054.0,33.49,World Kinect Corporation Common Stock
ARCO,1719010545.0,8.16,Arcos Dorados Holdings Inc. Class A Shares
MQY,1718950352.0,11.55,Blackrock MuniYield Quality Fund Inc. Common Stock
TIC,1717501033.0,7.77,TIC Solutions Inc. Common Stock
TRLV,1712418203.0,8.9,Trulieve Cannabis Corp. Subordinate Voting Shares
TPB,1708313336.0,88.2,Turning Point Brands Inc. Common Stock
MFP,1702156500.0,37.65,Midera Food Processing Inc. Common Stock
DV,1700383214.0,11.08,DoubleVerify Holdings Inc. Common Stock
NNNN,1699355072.0,11.81,Anbio Biotechnology Class A Ordinary Shares
AFGB,1699110397.0,20.45,American Financial Group Inc. 5.875% Subordinated Debentures
MPLT,1699102480.0,37.47,MapLight Therapeutics Inc. Common Stock
LPG,1697188955.0,39.67,Dorian LPG Ltd. Common Stock
FORTY,1695972090.0,110.72,Formula Systems (1985) Ltd. American Depositary Shares
AMBQ,1694883535.0,79.29,Ambiq Micro Inc. Common Stock
ABSI,1694687959.0,10.87,Absci Corporation Common Stock
HROW,1692289858.0,45.4,Harrow Inc. Common Stock
EFC,1692186956.0,13.49,Ellington Financial Inc. Common Stock 
TCBK,1691261270.0,53.0,TriCo Bancshares Common Stock
HURN,1691136942.0,104.31,Huron Consulting Group Inc. Common Stock
NEXA,1689921640.0,12.76,Nexa Resources S.A. Common Shares
BDJ,1688157278.0,9.54,Blackrock Enhanced Equity Dividend Trust
ECAT,1686906000.0,15.6,BlackRock ESG Capital Allocation Term Trust Common Shares of
NSP,1685169385.0,44.15,Insperity Inc. Common Stock
ADAMZ,1684895775.0,18.75,Adamas Trust Inc. 7.000% Series G Cumulative Redeemable Pref
NHPAP,1680457392.0,23.05,National Healthcare Properties Inc. 7.375% Series A Cumulati
GLP,1678360945.0,49.37,Global Partners LP Common Units representing Limited Partner
CTS,1677831959.0,58.68,CTS Corporation Common Stock
LILA,1677057633.0,7.57,Liberty Latin America Ltd. Class A Common Stock
HOPE,1675328562.0,13.11,Hope Bancorp Inc. Common Stock
TSAT,1670214049.0,46.19,Telesat Corporation Class A Common Shares and Class B Variab
TDOC,1668843489.0,9.24,Teladoc Health Inc. Common Stock
BL,1667729870.0,28.43,BlackLine Inc. Common Stock
ASAN,1666586049.0,7.23,Asana Inc. Class A Common Stock
NHPBP,1665876417.0,22.85,National Healthcare Properties Inc. 7.125% Series B Cumulati
AMSC,1665490019.0,34.92,American Superconductor Corporation Common Stock
CBL,1665137428.0,53.81,CBL & Associates Properties Inc. Common Stock
BY,1664476389.0,36.66,Byline Bancorp Inc. Common Stock
RZC,1664034340.0,25.4,Reinsurance Group of America Incorporated 7.125% Fixed-Rate 
WLFC,1663805158.0,216.93,Willis Lease Finance Corporation Common Stock
AMPX,1661286704.0,11.73,Amprius Technologies Inc. Common Stock
AAPG,1661283754.0,17.8,Ascentage Pharma Group International American Depository Sha
FLNG,1661176867.0,30.71,FLEX LNG Ltd. Ordinary Shares
SONO,1659462387.0,13.93,Sonos Inc. Common Stock
LILAK,1659334435.0,7.49,Liberty Latin America Ltd. Class C Common Stock
EOSE,1658263018.0,4.7,Eos Energy Enterprises Inc. Class A Common Stock
HCSG,1656408966.0,24.13,Healthcare Services Group Inc. Common Stock
LIND,1655675780.0,25.25,Lindblad Expeditions Holdings Inc. Common Stock
BVC,1653120000.0,9.84,BitVentures Limited Ordinary Shares
FIGS,1653099616.0,9.9,FIGS Inc. Class A Common Stock
GAB,1652721823.0,5.62,Gabelli Equity Trust Inc. (The) Common Stock
SHLS,1652552397.0,9.85,Shoals Technologies Group Inc. Class A Common Stock
ATRC,1650895622.0,32.6,AtriCure Inc. Common Stock
RQI,1649209010.0,12.28,Cohen & Steers Quality Income Realty Fund Inc Common Shares
XPRO,1648200438.0,14.54,Expro Group Holdings N.V. Common Stock
XZO,1645623583.0,18.1,Exzeo Group Inc. Common Stock
INVA,1645197015.0,22.29,Innoviva Inc. Common Stock
DXC,1639963396.0,9.91,DXC Technology Company Common Stock 
BFC,1637301997.0,146.67,Bank First Corporation Common Stock
PLAB,1636832256.0,27.76,Photronics Inc. Common Stock
MYI,1636372305.0,11.0,Blackrock MuniYield Quality Fund III Inc Common Stock
BBAI,1635612372.0,3.42,BigBear.ai Inc. Common Stock
ETV,1634654501.0,14.96,Eaton Vance Corporation Eaton Vance Tax-Managed Buy-Write Op
GENI,1630966116.0,6.34,Genius Sports Limited Ordinary Shares
MUC,1628949057.0,10.95,Blackrock MuniHoldings California Quality Fund Inc.  Common 
BPOPM,1626614871.0,25.2,Popular Inc. Popular Capital Trust II - 6.125% Cumulative Mo
AFGD,1624332923.0,19.55,American Financial Group Inc. 5.625% Subordinated Debentures
UZD,1623680000.0,18.88,Array Digital Infrastructure Inc. 6.250% Senior Notes due 20
SKYT,1622767774.0,32.98,SkyWater Technology Inc. Common Stock
PLPC,1622404503.0,331.92,Preformed Line Products Company Common Stock
TSLX,1621984572.0,17.07,Sixth Street Specialty Lending Inc. Common Stock
MUA,1618535684.0,10.88,Blackrock MuniAssets Fund Inc Common Stock
FRA,1617048060.0,10.87,Blackrock Floating Rate Income Strategies Fund Inc  Common S
NOMD,1616939727.0,11.38,Nomad Foods Limited Ordinary Shares
ULCC,1615419025.0,7.03,Frontier Group Holdings Inc. Common Stock
FTRE,1613876000.0,17.06,Fortrea Holdings Inc. Common Stock
WS,1612847200.0,31.75,Worthington Steel Inc. Common Shares
ITG,1609333427.0,13.28,ITG Inc. Class A Common Stock
KRP,1607996883.0,14.92,Kimbell Royalty Partners Common Units Representing Limited P
AVBP,1606602141.0,34.49,ArriVent BioPharma Inc. Common Stock
SEPN,1605590485.0,35.62,Septerna Inc. Common Stock
FRMEP,1603928758.0,25.45,First Merchants Corporation Depository Shares
KMTS,1597970538.0,27.38,Kestra Medical Technologies Ltd. Common Stock
DAO,1595996168.0,13.23,Youdao Inc. American Depositary Shares each representing one
CNOB,1592133720.0,31.66,ConnectOne Bancorp Inc. Common Stock
SFL,1591858026.0,11.01,SFL Corporation Ltd
OPI,1591852103.0,16.6,Office Properties Income Trust Common shares of beneficial i
IMCR,1589319835.0,33.05,Immunocore Holdings plc American Depositary Shares
PUMP,1584211330.0,12.92,ProPetro Holding Corp. Common Stock
AKTS,1580105822.0,28.59,Aktis Oncology Inc. Common stock
VSECU,1576952228.0,56.2,VSE Corporation Tangible Equity Units
PURR,1576355501.0,8.02,Hyperliquid Strategies Inc Common Stock
TRIN,1575730522.0,17.53,Trinity Capital Inc. Common Stock
RVLV,1572075280.0,21.97,Revolve Group Inc. Class A Common Stock
BKT,1570946570.0,10.56,BlackRock Income Trust Inc. (The)
LIME,1568823572.0,24.11,Neutron Holdings Inc. Common Stock
BRBR,1568006807.0,13.48,BellRing Brands Inc. Common Stock 
EYE,1565079051.0,19.54,National Vision Holdings Inc. Common Stock
PRGS,1564643737.0,38.15,Progress Software Corporation Common Stock (DE)
OBK,1563592585.0,50.59,Origin Bancorp Inc. Common Stock
BW,1559838285.0,10.48,Babcock & Wilcox Enterprises Inc. Common Stock
QCRH,1559184473.0,94.44,QCR Holdings Inc. Common Stock
OXLC,1552852000.0,8.95,Oxford Lane Capital Corp. Common Stock
NCV,1552617915.0,17.18,Virtus Convertible & Income Fund Common Shares of Beneficial
GAM,1548344894.0,64.58,General American Investors Inc. Common Stock
INNV,1547394880.0,11.4,InnovAge Holding Corp. Common Stock
OXSQG,1546765684.0,24.26,Oxford Square Capital Corp. 5.50% Notes due 2028
TRIP,1545858130.0,13.29,TripAdvisor Inc. Common Stock
NVAX,1544073937.0,9.39,Novavax Inc. Common Stock
REX,1540167694.0,46.76,REX American Resources Corporation
WBTN,1535928446.0,11.36,WEBTOON Entertainment Inc. Common stock
AAT,1533441217.0,24.98,American Assets Trust Inc. Common Stock
FCEL,1532724608.0,22.67,FuelCell Energy Inc. Common Stock
LZB,1531460855.0,38.38,La-Z-Boy Incorporated Common Stock
LKFN,1525957143.0,61.25,Lakeland Financial Corporation Common Stock
IDT,1520837154.0,61.16,IDT Corporation Class B Common Stock
ECCC,1515653162.0,24.98,Eagle Point Credit Company 6.50% Series C Term Preferred Sto
XERS,1514070822.0,8.77,Xeris Biopharma Holdings Inc. Common Stock
ARDT,1513776327.0,10.56,Ardent Health Inc. Common Stock
FOR,1513429108.0,29.67,Forestar Group Inc Common Stock 
SLVM,1503615386.0,37.84,Sylvamo Corporation Common Stock
PRGO,1497831110.0,10.82,Perrigo Company plc Ordinary Shares
MRVI,1494921513.0,5.79,Maravai LifeSciences Holdings Inc. Class A Common Stock
HLMN,1494136150.0,7.62,Hillman Solutions Corp. Common Stock
AIP,1489508139.0,32.26,Arteris Inc. Common Stock
PRSU,1489404075.0,54.52,Pursuit Attractions and Hospitality Inc. Common Stock
COAG,1489201998.0,31.89,Hemab Therapeutics Holdings Inc. Common Stock
PFBC,1487929424.0,103.64,Preferred Bank Common Stock
AFGC,1487240886.0,17.9,American Financial Group Inc. 5.125% Subordinated Debentures
PWP,1485092879.0,15.98,Perella Weinberg Partners Class A Common Stock
DFH,1482416321.0,16.2,Dream Finders Homes Inc. Class A Common Stock
TBLA,1481417988.0,5.42,Taboola.com Ltd. Ordinary Shares
LEG,1479609985.0,10.85,Leggett & Platt Incorporated Common Stock
ADNT,1474171676.0,18.8,Adient plc Ordinary Shares 
UZE,1472320000.0,17.12,Array Digital Infrastructure Inc. 5.500% Senior Notes due 20
AMC,1468334630.0,1.65,AMC Entertainment Holdings Inc. Class A Common Stock
PCT,1467245291.0,7.31,PureCycle Technologies Inc. Common stock
ODC,1465784852.0,101.17,Oil-Dri Corporation Of America Common Stock
VPG,1465238160.0,110.16,Vishay Precision Group Inc. Common Stock
CSWC,1463407883.0,23.55,Capital Southwest Corporation Common Stock
TNC,1462023072.0,85.81,Tennant Company Common Stock
CLVT,1460609725.0,2.29,Clarivate Plc Ordinary Shares
WINA,1456791854.0,407.19,Winmark Corporation Common Stock
KYIVW,1454440831.0,6.3,Kyivstar Group Ltd. Warrant
SVV,1454399262.0,9.45,Savers Value Village Inc. Common Stock
UZF,1453400000.0,16.9,Array Digital Infrastructure Inc. 5.500% Senior Notes due 20
HLIT,1450597349.0,13.37,Harmonic Inc. Common Stock
SLNHP,1450220784.0,10.26,Soluna Holdings Inc 9.0% Series A Cumulative Perpetual Prefe
CDNA,1448273550.0,28.04,CareDx Inc. Common Stock
PICS,1447492855.0,11.17,PicS N.V. Class A Common Shares
PGY,1446202112.0,17.44,Pagaya Technologies Ltd. Class A Ordinary Shares
TRS,1445288813.0,40.34,TriMas Corporation Common Stock
ATLC,1444774060.0,95.57,Atlanticus Holdings Corporation Common Stock
ECCV,1444374696.0,23.81,Eagle Point Credit Company 5.375% Notes due 2029
OI,1442548888.0,9.41,O-I Glass Inc. Common Stock
YELP,1442406166.0,26.23,Yelp Inc. Common Stock
ALNT,1440284427.0,84.74,Allient Inc. Common Stock
RMIX,1437761172.0,20.08,Suncrete Inc. Class A Common Stock
VIA,1435685082.0,17.66,Via Transportation Inc. Class A Common Stock
INBX,1434401855.0,97.77,Inhibrx Biosciences Inc. Common Stock
WEN,1432414413.0,7.52,Wendy's Company (The) Common Stock
JJSF,1427041191.0,76.09,J & J Snack Foods Corp. Common Stock
NICM,1423059396.0,6.2,Nicola Mining Inc. American Depositary Shares
GIII,1421822310.0,33.7,G-III Apparel Group LTD. Common Stock
IE,1419875589.0,8.97,Ivanhoe Electric Inc. Common Stock
ICFI,1419367712.0,78.4,ICF International Inc. Common Stock
PSNL,1416876456.0,13.53,Personalis Inc. Common Stock
ENOV,1416040034.0,24.6,Enovis Corporation Common Stock
CRI,1413563118.0,38.36,Carter's Inc. Common Stock
GBX,1412396666.0,45.65,Greenbrier Companies Inc. (The) Common Stock
MRTN,1411492036.0,17.3,Marten Transport Ltd. Common Stock
KMPB,1410626599.0,23.96,Kemper Corporation 5.875% Fixed-Rate Reset Junior Subordinat
GSL,1410150259.0,39.26,Global Ship Lease Inc New Class A Common Shares
VET,1407908000.0,9.19,Vermilion Energy Inc. Common (Canada)
ARLO,1406497130.0,12.95,Arlo Technologies Inc. Common Stock
TWFG,1405945312.0,25.95,TWFG Inc. Class A Common Stock
USAS,1405814304.0,4.3,Americas Gold and Silver Corporation Common Shares no par va
AGRO,1405564459.0,9.74,Adecoagro S.A. Common Shares
WYFI,1402665258.0,36.33,WhiteFiber Inc. Ordinary Shares
MLTX,1402373294.0,19.05,MoonLake Immunotherapeutics Class A Ordinary Shares
BORR,1400039891.0,4.55,Borr Drilling Limited Common Shares
BHRB,1398396536.0,69.4,Burke & Herbert Financial Services Corp. Common Stock
PLTK,1397894828.0,3.67,Playtika Holding Corp. Common Stock
SECZ,1397411833.0,7.6,Securitize Corp. Common Stock
IMTX,1390581493.0,10.37,Immatics N.V. Ordinary Shares
FMC,1387377615.0,11.1,FMC Corporation Common Stock
DMC,1385906620.0,29.13,Del Monte Corporation Ordinary Shares
AI,1382721319.0,8.89,C3.ai Inc. Class A Common Stock
ATEC,1382565852.0,8.99,Alphatec Holdings Inc. Common Stock
ENR,1377686518.0,20.12,Energizer Holdings Inc. Common Stock
WWW,1374144707.0,16.76,Wolverine World Wide Inc. Common Stock
HBNB,1373770106.0,5.87,Hotel101 Global Holdings Corp. Class A Ordinary Shares
LSPD,1371834605.0,10.29,Lightspeed Commerce Inc. Subordinate Voting Shares
AEVA,1370507449.0,21.74,Aeva Technologies Inc. Common Stock
NSSC,1368178370.0,38.3,NAPCO Security Technologies Inc. Common Stock
WABC,1367233861.0,58.21,Westamerica Bancorporation Common Stock
PEBO,1366731324.0,38.04,Peoples Bancorp Inc. Common Stock
ALX,1365485054.0,267.36,Alexander's Inc. Common Stock
AHCO,1364623145.0,10.03,AdaptHealth Corp. Common Stock
INSP,1364590926.0,47.36,Inspire Medical Systems Inc. Common Stock
MGTX,1364138171.0,14.73,MeiraGTx Holdings plc Ordinary Shares
ARI,1361045197.0,10.24,Apollo Commercial Real Estate Finance Inc
PNTG,1360110307.0,39.12,The Pennant Group Inc. Common Stock 
CRVS,1355537635.0,16.12,Corvus Pharmaceuticals Inc. Common Stock
ORC,1354966033.0,6.79,Orchid Island Capital Inc. Common Stock
SBH,1351461204.0,14.16,Sally Beauty Holdings Inc. (Name to be changed from Sally Ho
DOLE,1349353911.0,14.18,Dole plc Ordinary Shares
WLTH,1347984974.0,9.03,Wealthfront Corporation Common Stock
CCEC,1347697310.0,22.66,Capital Clean Energy Carriers Corp. Common Share
UFCS,1343613413.0,52.37,United Fire Group Inc. Common Stock
BLFS,1342846051.0,27.48,BioLife Solutions Inc. Common Stock
AMAL,1342537248.0,44.95,Amalgamated Financial Corp. Common Stock (DE)
XPEL,1342219970.0,48.7,XPEL Inc. Common Stock
HLF,1340445549.0,12.93,Herbalife Ltd. Common Shares
MLKN,1339461000.0,19.59,MillerKnoll Inc. Common Stock
IART,1338884701.0,17.21,Integra LifeSciences Holdings Corporation Common Stock
AFYA,1338866401.0,14.64,Afya Limited Class A Common Shares
LGIH,1337482302.0,57.57,LGI Homes Inc. Common Stock
OMDA,1335807952.0,22.47,Omada Health Inc. Common Stock
BLKB,1334557340.0,29.05,Blackbaud Inc. Common Stock
ARDX,1330253249.0,5.38,Ardelyx Inc. Common Stock
CAPR,1329946623.0,22.96,Capricor Therapeutics Inc. Common Stock
BV,1328100000.0,14.25,BrightView Holdings Inc. Common Stock
TMP,1326538648.0,92.23,Tompkins Financial Corporation Common Stock
AMRC,1325903482.0,25.04,Ameresco Inc. Class A Common Stock
POET,1325128866.0,8.67,POET Technologies Inc. Common Shares
NWPX,1323161198.0,137.3,NWPX Infrastructure Inc. Common Stock
HLX,1320509465.0,8.96,Helix Energy Solutions Group Inc. Common Stock
AFGE,1320237859.0,15.89,American Financial Group Inc. 4.500% Subordinated Debentures
KOS,1319846135.0,2.23,Kosmos Energy Ltd. Common Shares (DE)
MNKD,1319217209.0,4.27,MannKind Corporation Common Stock
CNXC,1319216727.0,21.62,Concentrix Corporation Common Stock
STAA,1318399348.0,26.48,STAAR Surgical Company Common Stock
GLOB,1317300305.0,30.51,Globant S.A. Common Shares
PAHC,1315108093.0,32.42,Phibro Animal Health Corporation Class A Common Stock
RYZ,1308114732.0,25.21,Ryerson Holding Corporation Common Stock
NVGS,1307618898.0,20.04,Navigator Holdings Ltd. Ordinary Shares (Marshall Islands)
SLSR,1306216265.0,7.82,Solaris Resources Inc. Common Shares
LOMA,1305835290.0,11.19,Loma Negra Compania Industrial Argentina Sociedad Anonima AD
AVLN,1304279655.0,29.42,Avalyn Pharma Inc. Common Stock
REAL,1303677217.0,10.82,The RealReal Inc. Common Stock
NRP,1300527938.0,98.15,Natural Resource Partners LP Limited Partnership
UMH,1300061967.0,15.27,UMH Properties Inc. Common Stock
ECVT,1299212855.0,11.87,Ecovyst Inc. Common Stock
SGML,1298268924.0,11.59,Sigma Lithium Corporation Common Shares
HQ,1295900617.0,25.12,Horizon Quantum Holdings Ltd. Class A Ordinary Shares
CTBI,1294165121.0,71.25,Community Trust Bancorp Inc. Common Stock
AMN,1294096625.0,33.37,AMN Healthcare Services Inc
UVV,1291286328.0,51.81,Universal Corporation Common Stock
SVRA,1284893619.0,6.27,Savara Inc. Common Stock
VTOL,1281495710.0,43.28,Bristow Group Inc. Common Stock
NUTX,1275490590.0,185.35,Nutex Health Inc. Common Stock
ASTE,1274021628.0,55.41,Astec Industries Inc. Common Stock
TTI,1271988918.0,9.39,Tetra Technologies Inc. Common Stock
NBR,1271309487.0,79.67,Nabors Industries Ltd.
TWO,1268434471.0,12.07,Two Harbors Investment Corp
NAT,1268386471.0,5.99,Nordic American Tankers Limited Common Stock
YSWY,1266422730.0,20.04,Yesway Inc. Class A Common Stock
RDWR,1266247612.0,29.93,Radware Ltd. Ordinary Shares
IRMD,1266223532.0,99.06,iRadimed Corporation Common Stock
CRML,1266181051.0,8.62,Critical Metals Corp. Ordinary Shares
LAC,1262733490.0,3.62,Lithium Americas Corp. Common Shares
SCL,1262406492.0,55.58,Stepan Company Common Stock
FMBH,1261987967.0,47.41,First Mid Bancshares Inc. Common Stock
TDAY,1258704112.0,8.58,USA TODAY Co. Inc. Common Stock
CNOBP,1258514822.0,25.03,ConnectOne Bancorp Inc. Depositary Shares each representing 
CXM,1257808452.0,5.37,Sprinklr Inc. Class A Common Stock
CDRE,1256961136.0,29.37,Cadre Holdings Inc. Common Stock
RES,1255578902.0,5.67,RPC Inc. Common Stock
IRS,1254708543.0,15.47,IRSA Inversiones Y Representaciones S.A. Global Depositary S
ROCK,1254699174.0,42.3,Gibraltar Industries Inc. Common Stock
PBT,1254009656.0,26.91,Permian Basin Royalty Trust Common Stock
LADR,1251785564.0,9.8,Ladder Capital Corp Class A Common Stock
PXED,1251056481.0,34.94,Phoenix Education Partners Inc. Common Stock
GIC,1248459660.0,32.63,Global Industrial Company Common Stock
BJRI,1248300201.0,59.4,BJ's Restaurants Inc. Common Stock
DMLP,1247581928.0,25.85,Dorchester Minerals L.P. Common Units Representing Limited P
GCT,1236795347.0,33.62,GigaCloud Technology Inc Class A Ordinary Shares
UAN,1235590565.0,116.9,CVR Partners LP Common Units representing Limited Partner In
GHM,1234759751.0,105.61,Graham Corporation Common Stock
GOLD,1233846070.0,42.54,Gold.com Inc. Common Stock
DSGR,1233410906.0,26.7,Distribution Solutions Group Inc. Common Stock
LZ,1232430946.0,7.18,LegalZoom.com Inc. Common Stock
ACVA,1230823503.0,7.05,ACV Auctions Inc. Class A Common Stock
WVE,1230412082.0,6.39,Wave Life Sciences Ltd. Ordinary Shares
SENEB,1228699451.0,181.48,Seneca Foods Corp. Class B Common Stock
CCO,1226650249.0,2.41,Clear Channel Outdoor Holdings Inc. Common Stock
LIFE,1222403654.0,19.41,Ethos Technologies Inc. Class A Common Stock
APPS,1221702537.0,10.12,Digital Turbine Inc. Common Stock
EPC,1220924732.0,26.5,Edgewell Personal Care Company Common Stock
OPY,1213966527.0,113.37,Oppenheimer Holdings Inc. Class A Common Stock (DE)
LAR,1212120000.0,7.4,Lithium Argentina AG Common Shares
IGIC,1209071599.0,28.22,International General Insurance Holdings Ltd. Ordinary Share
IAUX,1206871604.0,1.4,i-80 Gold Corp. Common Shares
SENEA,1206052329.0,178.13,Seneca Foods Corp. Class A Common Stock
SDGR,1205992485.0,16.14,Schrodinger Inc. Common Stock
WAFDP,1205121109.0,16.31,WaFd Inc. Depositary Shares
LU,1204697560.0,1.39,Lufax Holding Ltd American Depositary Shares each representi
DCH,1204636165.0,5.08,Dauch Corporation Common Stock
BULLW,1201910183.0,2.26,Webull Corporation Warrants
UVSP,1201546356.0,43.15,Univest Financial Corporation Common Stock
CMP,1199589169.0,28.59,Compass Minerals Intl Inc Common Stock
CEVA,1198549057.0,43.02,CEVA Inc. Common Stock
ENRD,1198015072.0,8.31,Einride AB American Depositary Shares
HFWA,1196788352.0,29.04,Heritage Financial Corporation Common Stock
MMI,1195547351.0,31.61,Marcus & Millichap Inc. Common Stock
AVO,1194083791.0,13.52,Mission Produce Inc. Common Stock
EYPT,1192642464.0,14.22,EyePoint Inc. Common Stock
NCZ,1187786263.0,15.61,Virtus Convertible & Income Fund II Common Shares of Benefic
SPH,1187540720.0,17.9,Suburban Propane Partners L.P. Common Stock
MCB,1183827061.0,95.51,Metropolitan Bank Holding Corp. Common Stock
PRCT,1183342767.0,20.79,PROCEPT BioRobotics Corporation Common Stock
PDM,1181429578.0,9.45,Piedmont Realty Trust Inc. Class A Common Stock
COLL,1180589556.0,36.4,Collegium Pharmaceutical Inc. Common Stock
ASIC,1179922096.0,24.57,Ategrity Specialty Insurance Company Holdings Common Stock
RHLD,1177346080.0,142.58,Resolute Holdings Management Common Stock 
LQDT,1176935564.0,37.74,Liquidity Services Inc. Common Stock
XIFR,1175581754.0,12.47,XPLR Infrastructure LP Common Units representing limited par
TRUP,1172954492.0,26.89,Trupanion Inc. Common Stock
SCCD,1168412402.0,24.68,Sachem Capital Corp. 6.00% Notes due 2026
XNCR,1167730137.0,15.75,Xencor Inc. Common Stock
NPKI,1167480273.0,13.82,NPK International Inc. Common Stock
AVNS,1167342089.0,24.93,Avanos Medical Inc. Common Stock
IMPPP,1166964513.0,25.81,Imperial Petroleum Inc. 8.75% Series A Cumulative Redeemable
RCAT,1166666141.0,9.51,Red Cat Holdings Inc. Common Stock
MBINM,1165840655.0,25.38,Merchants Bancorp Depositary Shares Each Representing a 1/40
AORT,1165525834.0,24.01,Artivion Inc. Common Stock
TEN,1165154918.0,38.67,Tsakos Energy Navigation Ltd Common Shares
SCCG,1165093708.0,24.61,Sachem Capital Corp. 8.00% Notes due 2027
LNN,1164235644.0,114.49,Lindsay Corporation Common Stock
UVE,1163474954.0,41.69,UNIVERSAL INSURANCE HOLDINGS INC Common Stock
SMPL,1163236404.0,12.86,The Simply Good Foods Company Common Stock
OSBC,1162376750.0,22.6,Old Second Bancorp Inc. Common Stock
CCB,1161501705.0,76.17,Coastal Financial Corporation Common Stock
UPBD,1160045147.0,19.9,Upbound Group Inc. Common Stock
SCCF,1159412633.0,24.49,Sachem Capital Corp. 7.125% Notes due 2027
DEA,1159144128.0,24.95,Easterly Government Properties Inc. Common Stock
HTLD,1157696058.0,14.94,Heartland Express Inc. Common Stock
SCCE,1157518942.0,24.45,Sachem Capital Corp. 6.00% Notes due 2027
AMPL,1156439825.0,8.72,Amplitude Inc. Class A Common Stock
TUYA,1156044306.0,1.89,Tuya Inc. American Depositary Shares each representing one C
SANA,1154910099.0,4.15,Sana Biotechnology Inc. Common Stock
UTZ,1153966209.0,8.02,Utz Brands Inc Class A Common Stock 
WLDN,1152108154.0,76.25,Willdan Group Inc. Common Stock
AZTA,1151859172.0,24.99,Azenta Inc.
LMRI,1150566802.0,11.97,Lumexa Imaging Holdings Inc. Common Stock
SAFE,1148624432.0,16.04,Safehold Inc. New Common Stock 
BRAI,1147911430.0,5.57,Braiin Limited Common Stock
HBT,1147095389.0,31.53,HBT Financial Inc. Common Stock
MYE,1143244882.0,30.44,Myers Industries Inc. Common Stock
MBINL,1141494889.0,24.85,Merchants Bancorp Depositary Shares Each Representing a 1/40
