ticker,mcap_usd,price,name
NOAH,692308359.0,10.32,Noah Holdings Limited American Depositary Shares
TRAX,691566991.0,19.82,First Tracks Biotherapeutics Inc. Ordinary Shares 
SPIR,691362444.0,17.19,Spire Global Inc. Class A Common Stock
RLMD,691226570.0,6.59,Relmada Therapeutics Inc. Common Stock
SWBI,689915024.0,15.43,Smith & Wesson Brands Inc. Common Stock
JBI,689463880.0,5.05,Janus International Group Inc. Common Stock
KRO,689168165.0,5.99,Kronos Worldwide Inc Common Stock
ANGX,687861623.0,3.69,Angel Studios Inc. Class A Common Stock
CUBB,687810908.0,21.75,Customers Bancorp Inc 5.375% Subordinated Notes Due 2034
FDMT,687694121.0,13.15,4D Molecular Therapeutics Inc. Common Stock
WEST,687295842.0,7.04,Westrock Coffee Company Common Stock
SB,685040039.0,6.7,Safe Bulkers Inc Common Stock ($0.001 par value)
SLRC,684115110.0,12.54,SLR Investment Corp. Common Stock
DLY,678432773.0,14.15,DoubleLine Yield Opportunities Fund Common Shares of Benefic
WASH,678353799.0,35.58,Washington Trust Bancorp Inc. Common Stock
PSTL,678165714.0,24.55,Postal Realty Trust Inc. Class A Common Stock
FTH,677207868.0,26.27,Faeth Therapeutics Inc. Common Stock
TMS,676969501.0,7.49,Teamshares Inc. Common Stock
BWMX,676535807.0,18.16,Betterware de Mexico S.A.P.I. de C.V. Ordinary Shares
NEWTG,676466332.0,25.7,NewtekOne Inc. 8.50% Fixed Rate Senior Notes due 2029
SXC,676279988.0,7.97,SunCoke Energy Inc. Common Stock
SWIM,675116637.0,5.75,Latham Group Inc. Common Stock
CWH,675078140.0,6.55,Camping World Holdings Inc. Class A Common Stock
FOF,674427669.0,13.72,Cohen & Steers Closed-End Opportunity Fund Inc. Common Stock
TIPT,674382846.0,17.95,Tiptree Inc. Common Stock
KRT,671779548.0,33.65,Karat Packaging Inc. Common Stock
BLMN,669503724.0,7.82,Bloomin' Brands Inc. Common Stock
NXP,669461311.0,14.3,Nuveen Select Tax Free Income Portfolio Common Stock
TCBX,669324144.0,40.34,Third Coast Bancshares Inc. Common Stock
MCS,668341243.0,21.75,Marcus Corporation (The) Common Stock
YB,668162915.0,14.5,Yuanbao Inc. American Depositary Shares
NEWTI,668135466.0,25.38,NewtekOne Inc. 8.00% Fixed Rate Senior Notes due 2028
PRAA,667846949.0,17.51,PRA Group Inc. Common Stock
GROY,666638973.0,2.62,Gold Royalty Corp. Common Shares
VTS,666564536.0,15.98,Vitesse Energy Inc. Common Stock
PFIS,666224131.0,66.55,Peoples Financial Services Corp. Common Stock
NMFC,665889350.0,7.05,New Mountain Finance Corporation Common Stock
RSVR,665153163.0,10.13,Reservoir Media Inc. Common Stock
CCSI,664901913.0,36.14,Consensus Cloud Solutions Inc. Common Stock
VMO,663953544.0,9.85,Invesco Municipal Opportunity Trust Common Stock
MEC,663800854.0,32.39,Mayville Engineering Company Inc. Common Stock
CASS,663379019.0,51.54,Cass Information Systems Inc Common Stock
ACHV,663177508.0,6.46,Achieve Life Sciences Inc. Common Shares
AMSF,662300531.0,35.41,AMERISAFE Inc. Common Stock
NRGV,662184626.0,3.71,Energy Vault Holdings Inc. Common Stock
PHR,662005331.0,10.71,Phreesia Inc. Common Stock
BMM,660636906.0,6.3,Blue Moon Metals Inc. Common Shares
AROW,660582244.0,39.97,Arrow Financial Corporation Common Stock
BCAL,659459304.0,20.5,California BanCorp Common Stock
MAKO,658486145.0,7.52,Mako Mining Corp Common Stock
FBIOP,656079994.0,19.75,Fortress Biotech Inc. 9.375% Series A Cumulative Redeemable 
NB,655869651.0,4.5,NioCorp Developments Ltd. Common Stock
CGNT,650086417.0,8.95,Cognyte Software Ltd. Ordinary Shares
TRTX,649388956.0,8.4,TPG RE Finance Trust Inc. Common Stock
HTZ,648896095.0,2.06,Hertz Global Holdings Inc Common Stock
MGRE,648079157.0,22.81,Affiliated Managers Group Inc. 6.750% Junior Subordinated No
AGMB,644902233.0,13.1,AgomAb Therapeutics NV American Depositary Shares
GAIN,643921206.0,16.17,Gladstone Investment Corporation Business Development Compan
ASPI,643366614.0,5.11,ASP Isotopes Inc. Common Stock
DRUG,641708789.0,65.4,Bright Minds Biosciences Inc. Common Stock
LAES,641589117.0,2.88,SEALSQ Corp Ordinary Shares
HELE,641230439.0,27.53,Helen of Troy Limited Common Stock
ASC,641009066.0,15.71,Ardmore Shipping Corporation Common Stock
RMT,640595786.0,13.85,Royce Micro-Cap Trust Inc. Common Stock
GSM,639062968.0,3.42,Ferroglobe PLC Ordinary Shares
VRRM,637248409.0,4.2,Verra Mobility Corporation Class A Common Stock
VINP,637211235.0,9.74,Vinci Compass Investments Ltd. Class A Common Shares
IMSR,635611524.0,6.0,Terrestrial Energy Inc. Common Stock  
EIKN,635316800.0,11.73,Eikon Therapeutics Inc. Common Stock
VLGEA,631920981.0,42.67,Village Super Market Inc. Class A Common Stock
XFLT,628502387.0,17.72,XAI Floating Rate & Alternative Income Trust Common Shares o
CARS,627785422.0,11.01,Cars.com Inc. Common Stock 
RRBI,627587376.0,95.31,Red River Bancshares Inc. Common Stock
NPB,626795886.0,18.12,Northpointe Bancshares Inc. Common Stock
KRUS,626101838.0,51.54,Kura Sushi USA Inc. Class A Common Stock
CNNE,625712805.0,14.24,Cannae Holdings Inc. Common Stock
TREE,625513797.0,44.83,LendingTree Inc. Common Stock
MNPR,624888503.0,93.28,Monopar Therapeutics Inc. Common Stock
BSTZ,623977787.0,28.16,BlackRock Science and Technology Term Trust Common Shares of
RILYT,623665000.0,20.45,BRC Group Holdings Inc. 6.00% Senior Notes Due 2028
MTA,622328795.0,6.66,Metalla Royalty & Streaming Ltd. Common Shares
QH,622294250.0,6.37,Quhuo Limited American Depository Shares
CERS,621744926.0,3.1,Cerus Corporation Common Stock
NRDS,621140512.0,9.44,NerdWallet Inc. Class A Common Stock
NCDL,620301536.0,12.56,Nuveen Churchill Direct Lending Corp. Common Stock
ELA,619488537.0,23.86,Envela Corporation Common Stock
AXG,618974938.0,3.25,Solowin Holdings Class A Ordinary Share
SMC,618501479.0,30.41,Summit Midstream Corporation Common Stock
CSV,618385899.0,38.96,Carriage Services Inc. Common Stock
CCOI,617457585.0,12.33,Cogent Communications Holdings Inc.
MDXG,617380055.0,4.14,MiMedx Group Inc Common Stock
NFBK,616016817.0,14.75,Northfield Bancorp Inc. Common Stock (Delaware)
HIFS,615895794.0,286.81,Hingham Institution for Savings Common Stock
BHB,615351010.0,36.75,Bar Harbor Bankshares Inc. Common Stock
MSBI,615260434.0,29.68,Midland States Bancorp Inc. Common Stock
GRNT,614635313.0,4.66,Granite Ridge Resources Inc. Common Stock
UHT,614272723.0,44.27,Universal Health Realty Income Trust Common Stock
NDMO,613978541.0,10.32,Nuveen Dynamic Municipal Opportunities Fund Common Shares of
RGR,613534855.0,38.48,Sturm Ruger & Company Inc. Common Stock
RMR,613006006.0,19.71,The RMR Group Inc. Class A Common Stock
SLI,610358698.0,2.5,Standard Lithium Ltd. Common Shares
KYTX,610079952.0,10.04,Kyverna Therapeutics Inc. Common Stock
FEIM,607591363.0,61.73,Frequency Electronics Inc. Common Stock
ALTI,606471360.0,4.0,AlTi Global Inc. Class A Common Stock
EVH,606272951.0,5.39,Evolent Health Inc Class A Common Stock
BHFAM,606053032.0,10.55,Brighthouse Financial Inc. Depositary shares each representi
NEXN,605307351.0,9.23,Nexxen International Ltd. Ordinary Shares
IIM,605064783.0,12.86,Invesco Value Municipal Income Trust Common Stock
GOOD,604603343.0,12.49,Gladstone Commercial Corporation Real Estate Investment Trus
NVCT,602295308.0,19.11,Nuvectis Pharma Inc. Common Stock
PUBM,600976626.0,12.94,PubMatic Inc. Class A Common Stock
BWAY,599694729.0,14.98,BrainsWay Ltd. American Depositary Shares
FBRT,598772210.0,7.78,Franklin BSP Realty Trust Inc. Common Stock
QNC,597782351.0,2.73,Quantum eMotion Corp. Common Shares
KLC,597470768.0,5.04,KinderCare Learning Companies Inc. Common Stock
RWT,597279065.0,4.77,Redwood Trust Inc. Common Stock
FISN,597206687.0,10.14,Deep Fission Inc. Common Stock
LEGH,596442553.0,25.08,Legacy Housing Corporation Common Stock (TX)
ACNB,595157924.0,58.28,ACNB Corporation Common Stock
IIIV,594801591.0,21.3,i3 Verticals Inc. Class A Common Stock
BALY,594727859.0,12.15,Bally's Corporation Common Stock
CLDT,594718743.0,12.74,Chatham Lodging Trust (REIT) Common Shares of Beneficial Int
NRIM,594602595.0,26.73,Northrim BanCorp Inc Common Stock
NMCO,593996636.0,10.85,Nuveen Municipal Credit Opportunities Fund Common Shares
IHRT,592517396.0,3.92,iHeartMedia Inc. Class A Common Stock
KRNY,591392144.0,9.13,Kearny Financial Corp Common Stock
FLGT,589312927.0,20.75,Fulgent Genetics Inc. Common Stock
WHFCL,589212281.0,25.35,WhiteHorse Finance Inc. 7.875% Notes due 2028
BTQ,588768273.0,4.17,BTQ Technologies Corp. Common Stock
ALT,588284316.0,3.02,Altimmune Inc. Common Stock
NFGC,587646300.0,1.53,New Found Gold Corp Common Shares
SCZM,587315939.0,6.35,Santacruz Silver Mining Ltd. Common Shares
BWB,586944875.0,21.05,Bridgewater Bancshares Inc. Common Stock
TATT,586643045.0,45.19,TAT Technologies Ltd. Ordinary Shares
AIIO,585556747.0,4.2,Robo.ai Inc. Class B Ordinary Shares
KE,585110345.0,24.33,Kimball Electronics Inc. Common Stock
BME,584319514.0,43.83,Blackrock Health Sciences Trust
GCBC,583122861.0,34.25,Greene County Bancorp Inc. Common Stock
NTGR,581352299.0,21.66,NETGEAR Inc. Common Stock
NPCE,581298352.0,17.05,Neuropace Inc. Common Stock
CTKB,579204503.0,4.49,Cytek Biosciences Inc. Common Stock
ORN,578448883.0,14.29,Orion Group Holdings Inc. Common
BRBI,576570279.0,11.5,BRBI BR Partners S.A. ADSs
BTGO,576318263.0,4.97,BitGo Holdings Inc. Class A Common Stock
CIVB,576114407.0,27.72,Civista Bancshares Inc. Common Stock
VGM,573855569.0,10.58,Invesco Trust for Investment Grade Municipals Common Stock (
ILPT,573323051.0,8.6,Industrial Logistics Properties Trust Common Shares of Benef
DNUT,573230000.0,3.33,Krispy Kreme Inc. Common Stock
TOI,572402291.0,5.72,The Oncology Institute Inc. Common Stock
RILYL,571970524.0,14.23,BRC Group Holdings Inc. Depositary Shares each representing 
ISOU,571124539.0,9.42,IsoEnergy Ltd. Common Shares
STTK,570503046.0,7.44,Shattuck Labs Inc. Common Stock
HY,568829889.0,31.75,Hyster-Yale Inc. Class A common stock
SFST,568349968.0,60.11,Southern First Bancshares Inc. Common Stock
PROK,567872097.0,1.88,ProKidney Corp. Class A Ordinary Shares
MGR,567673019.0,19.98,Affiliated Managers Group Inc. 5.875% Junior Subordinated No
OBE,567602591.0,8.4,Obsidian Energy Ltd. Common Shares
AIOT,567585114.0,4.23,PowerFleet Inc. Common Stock
BTBT,567434433.0,1.62,Bit Digital Inc. Ordinary Shares
CBNK,567236411.0,34.78,Capital Bancorp Inc. Common Stock
RILYP,567147161.0,14.11,BRC Group Holdings Inc. Depositary Shares each representing 
DNA,565743245.0,9.11,Ginkgo Bioworks Holdings Inc. Class A Common Stock
RFI,565094222.0,11.5,Cohen & Steers Total Return Realty Fund Inc. Common Stock
ASIX,563713443.0,20.91,AdvanSix Inc. Common Stock 
RILYZ,563585780.0,18.48,BRC Group Holdings Inc. 5.25% Senior Notes due 2028
PRTH,563309363.0,6.84,Priority Technology Holdings Inc. Common Stock
AGCC,563026150.0,15.1,Agencia Comercial Spirits Ltd Class A Ordinary Shares
DDI,562927078.0,11.36,DoubleDown Interactive Co. Ltd. American Depository Shares
EVGO,561808263.0,1.79,EVgo Inc. Class A Common Stock
DC,560489086.0,4.18,Dakota Gold Corp. Common Stock
CTNM,560421791.0,14.99,Contineum Therapeutics Inc. Class A Common Stock
THM,559904192.0,2.14,International Tower Hill Mines Ltd. Ordinary Shares (Canada)
OPTU,559850664.0,1.18,Optimum Communications Inc. Class A common stock
BWBBP,559061508.0,20.05,Bridgewater Bancshares Inc. Depositary Shares Each Represent
IIIN,558511519.0,28.74,Insteel Industries Inc. Common Stock
ACIC,558305821.0,11.52,American Coastal Insurance Corporation Common Stock
EGY,557781654.0,5.35,VAALCO Energy Inc.  Common Stock
ARVN,557463151.0,8.64,Arvinas Inc. Common Stock
XOMA,556194681.0,44.35,XOMA Royalty Corporation Common Stock
XMAX,555884329.0,8.74,XMAX Inc. Common Stock
VITL,555315964.0,12.96,Vital Farms Inc. Common Stock
VKQ,553908505.0,10.01,Invesco Municipal Trust Common Stock
MLR,553603883.0,48.58,Miller Industries Inc. Common Stock
UNTY,553077984.0,55.08,Unity Bancorp Inc. Common Stock
GLRE,552055527.0,16.64,Greenlight Capital Re Ltd. Class A Ordinary Shares
PCTTW,549966087.0,2.74,PureCycle Technologies Inc. Warrant
BBCP,547272541.0,10.86,Concrete Pumping Holdings Inc. Common Stock
OLP,547253575.0,25.08,One Liberty Properties Inc. Common Stock
FET,547240485.0,48.41,Forum Energy Technologies Inc. Common Stock
MEI,547152608.0,15.43,Methode Electronics Inc. Common Stock
TMQ,546969676.0,3.17,Trilogy Metals Inc. Common Stock
OXM,546348184.0,36.59,Oxford Industries Inc. Common Stock
MYGN,545910654.0,5.78,Myriad Genetics Inc. Common Stock
PACK,542568370.0,6.34,Ranpak Holdings Corp Class A Common Stock
AQST,539508048.0,4.3,Aquestive Therapeutics Inc. Common Stock
IQI,538357053.0,10.18,Invesco Quality Municipal Income Trust Common Stock
OSPN,538297782.0,14.52,OneSpan Inc. Common Stock
HUYA,537597577.0,2.4,HUYA Inc. American depositary shares each  representing one 
SLDP,537351050.0,2.39,Solid Power Inc. Class A Common Stock
OOMA,537350000.0,19.54,Ooma Inc. Common Stock
AHRT,537004650.0,7.07,AH Realty Trust Inc. Common Stock
BDN,536769601.0,3.09,Brandywine Realty Trust Common Stock
ETD,536408826.0,21.08,Ethan Allen Interiors Inc. Common Stock
ANGO,535286544.0,12.96,AngioDynamics Inc. Common Stock
MNRO,533540391.0,17.07,Monro Inc. Common Stock
HBCP,533455761.0,68.02,Home Bancorp Inc. Common Stock
EBF,533287574.0,21.08,Ennis Inc. Common Stock
HQL,531830397.0,20.71,abrdn Life Sciences Investors Shares of Beneficial Interest
SMWB,531365022.0,6.11,Similarweb Ltd. Ordinary Shares
ROMA,528933390.0,8.88,Roma Green Finance Limited Class A Ordinary Shares
STRO,528845561.0,31.91,Sutro Biopharma Inc. Common Stock
WEAV,528315816.0,6.64,Weave Communications Inc. Common Stock
CTEV,527884786.0,30.96,Claritev Corporation Class A Common Stock
MG,527838738.0,16.59,Mistras Group Inc Common Stock
METCB,527389793.0,7.93,Ramaco Resources Inc. Class B Common Stock
MSIF,526004656.0,11.6,MSC Income Fund Inc. Common Stock
FIP,525827820.0,4.45,FTAI Infrastructure Inc. Common Stock 
MLAB,524868445.0,95.0,Mesa Laboratories Inc. Common Stock
BSRR,524867654.0,40.13,Sierra Bancorp Common Stock
CSHR,524485232.0,3.98,CoinShares PLC Ordinary Shares
ITIC,524107690.0,277.6,Investors Title Company Common Stock
ADUR,524043740.0,15.02,Aduro Clean Technologies Inc. Common Stock
NKLR,522669295.0,4.73,Terra Innovatum Global N.V. Ordinary shares
FBIZ,522551753.0,62.49,First Business Financial Services Inc. Common Stock
CABA,521775347.0,3.2,Cabaletta Bio Inc. Common Stock
MSBIP,519903359.0,25.08,Midland States Bancorp Inc. Depositary Shares Each Represent
WTI,519234166.0,3.49,W&T Offshore Inc. Common Stock
TYG,516478200.0,43.3,Tortoise Energy Infrastructure Corporation Common Stock
VCV,515302049.0,10.76,Invesco California Value Municipal Income Trust Common Stock
PRTA,515155852.0,9.84,Prothena Corporation plc Ordinary Shares
CHCT,514577992.0,18.01,Community Healthcare Trust Incorporated Common Stock
URG,514544750.0,1.29,Ur Energy Inc Common Shares (Canada)
GPRK,513969548.0,9.94,Geopark Ltd Common Shares
PKOH,512286853.0,35.58,Park-Ohio Holdings Corp. Common Stock
ZURA,511087680.0,5.38,Zura Bio Limited Class A Ordinary Shares
GUT,510857242.0,6.96,Gabelli Utility Trust (The) Common Stock
YEXT,509260429.0,5.08,Yext Inc. Common Stock
CLPT,507123510.0,16.91,ClearPoint Neuro Inc. Common Stock
ARQQ,506143191.0,21.01,Arqit Quantum Inc. Ordinary Shares
CLB,505911085.0,10.97,Core Laboratories Inc. Common Stock
VALN,505579044.0,5.33,Valneva SE American Depositary Shares
CYH,505186413.0,3.58,Community Health Systems Inc. Common Stock
ETO,504918532.0,30.81,Eaton Vance Tax-Advantage Global Dividend Opp Common Stock
BETR,504012972.0,26.71,Better Home & Finance Holding Company Class A Common Stock
PSFE,503960366.0,7.91,Paysafe Limited Common Shares
OVID,503928275.0,2.7,Ovid Therapeutics Inc. Common Stock
NRC,503469789.0,22.34,NRC Health Common Stock
NGS,503178698.0,39.94,Natural Gas Services Group Inc. Common Stock
OIS,502615015.0,8.35,Oil States International Inc. Common Stock
FTHY,501583570.0,13.64,First Trust High Yield Opportunities 2027 Term Fund Common S
TLRY,501047180.0,4.3,Tilray Brands Inc. Common Stock 
SD,500980775.0,13.57,SandRidge Energy Inc. Common Stock
OCGN,499319738.0,1.48,Ocugen Inc. Common Stock
CTGO,499109042.0,16.22,Contango Silver & Gold Inc. Common Stock
KIDS,497518334.0,19.37,OrthoPediatrics Corp. Common Stock
ALIT,496411590.0,18.48,Alight Inc. Class A Common Stock
ELMT,496166733.0,16.55,The Elmet Group Co. Common Stock
STRZ,494055586.0,29.43,Starz Entertainment Corp. Common Shares
YORW,493817513.0,30.46,York Water Company (The) Common Stock
MBUU,493380957.0,25.12,Malibu Boats Inc. Class A Common Stock
COFS,492678652.0,32.9,ChoiceOne Financial Services Inc. Common Stock
TRC,491747101.0,18.21,Tejon Ranch Co Common Stock
ADV,491659454.0,36.98,Advantage Solutions Inc. Class A Common Stock
GEMI,490878074.0,4.12,Gemini Space Station Inc. Class A Common Stock
SWMR,490448700.0,43.75,Swarmer Inc Common Stock
XRN,490085755.0,37.03,Chiron Real Estate Inc. Common Stock
BSVN,490055366.0,51.48,Bank7 Corp. Common stock
EVMN,489489675.0,13.59,Evommune Inc. Common Stock
WNC,488494344.0,12.01,Wabash National Corporation Common Stock
SFIX,488338633.0,3.66,Stitch Fix Inc. Class A Common Stock
BWMN,488290701.0,27.89,Bowman Consulting Group Ltd. Common Stock
LOCO,486675662.0,15.98,El Pollo Loco Holdings Inc. Common Stock
GMTL,486572014.0,12.54,Guardian Metal Resources PLC ADS
ESEA,485930763.0,68.87,Euroseas Ltd. Common Stock (Marshall Islands)
GAU,485857601.0,1.86,Galiano Gold Inc.
CNCK,485248872.0,2.53,Coincheck Group N.V. Ordinary Shares
PDLB,485209294.0,20.06,Ponce Financial Group Inc. Common Stock
GDYN,484696609.0,5.8,Grid Dynamics Holdings Inc. Class A Common Stock
VRXA,482257205.0,3.41,Veraxa Biotech AG Ordinary Shares
IDR,482200700.0,30.5,Idaho Strategic Resources Inc. Common Stock
OBT,482148228.0,35.96,Orange County Bancorp Inc. Common Stock
ECX,480135580.0,1.26,ECARX Holdings Inc. Class A Ordinary shares
GRRR,479649151.0,17.28,Gorilla Technology Group Inc. Ordinary shares
WRN,478342914.0,2.12,Western Copper and Gold Corporation Common Stock
SPT,477839027.0,7.95,Sprout Social Inc Class A Common Stock
CPS,477617140.0,26.9,Cooper-Standard Holdings Inc. Common Stock
DDL,476943696.0,2.02,Dingdong (Cayman) Limited American Depositary Shares (each t
CBIO,476718756.0,17.29,Crescent Biopharma Inc. Common Stock
CCCC,476544727.0,4.31,C4 Therapeutics Inc. Common Stock
CTRN,476508955.0,57.2,Citi Trends Inc. Common Stock
SLN,476190000.0,10.18,Silence Therapeutics Plc American Depository Share
RZLT,476165577.0,4.95,Rezolute Inc. Common Stock (NV)
RYAM,475441770.0,7.05,Rayonier Advanced Materials Inc. Common Stock
CLNE,473482963.0,2.15,Clean Energy Fuels Corp. Common Stock
GOGO,471982445.0,3.49,Gogo Inc. Common Stock
IPI,471230692.0,35.08,Intrepid Potash Inc Common Stock
TENX,470768522.0,17.75,Tenax Therapeutics Inc. Common Stock
DCBO,470607648.0,18.31,Docebo Inc. Common Shares
SGMT,468696215.0,7.59,Sagimet Biosciences Inc. Series A Common Stock
PACB,467455540.0,1.5,Pacific Biosciences of California Inc. Common Stock
OFIX,466465864.0,11.54,Orthofix Medical Inc. Common Stock (DE)
BNTC,466360084.0,13.57,Benitec Biopharma Inc. Common Stock
TASK,466133063.0,5.09,TaskUs Inc. Class A Common Stock
EOLS,465593090.0,7.07,Evolus Inc. Common Stock
FVR,465046135.0,20.53,FrontView REIT Inc. Common Stock
TWI,464765551.0,7.22,Titan International Inc. (DE) Common Stock
FRPH,464495763.0,24.23,FRP Holdings Inc. Common Stock
MGRB,464253109.0,16.34,Affiliated Managers Group Inc. 4.750% Junior Subordinated No
PAYS,464017916.0,8.3,Paysign Inc. Common Stock
CLMB,463907154.0,24.95,Climb Global Solutions Inc. Common Stock
CRNC,463626920.0,10.26,Cerence Inc. Common Stock
ASMB,461362410.0,29.03,Assembly Biosciences Inc. Common Stock
KELYA,459713459.0,13.26,Kelly Services Inc. Class A Common Stock
KREF,459426479.0,7.14,KKR Real Estate Finance Trust Inc. Common Stock
SERV,459210512.0,5.93,Serve Robotics Inc. Common Stock
RCKT,459158874.0,4.21,Rocket Pharmaceuticals Inc. Common Stock
CWCO,458805448.0,28.68,Consolidated Water Co. Ltd. Ordinary Shares
LXFR,456759073.0,16.77,Luxfer Holdings PLC Ordinary Shares
CRMLW,455355134.0,3.1,Critical Metals Corp. Warrants
VMD,455057840.0,11.87,Viemed Healthcare Inc. Common Shares
GBFH,454803163.0,31.43,GBank Financial Holdings Inc. Common Stock
REAX,454751164.0,2.13,The Real Brokerage Inc. Common Shares
DCTH,454304875.0,13.16,Delcath Systems Inc. Common Stock
CBK,453374991.0,33.09,Commercial Bancgroup Inc. Common Stock
PHOE,453276000.0,20.98,Phoenix Asia Holdings Limited Ordinary Shares
CMDB,453142045.0,18.74,Costamare Bulkers Holdings Limited Common Stock
FBRX,452991432.0,22.12,Forte Biosciences Inc. Common Stock
ETB,452466386.0,15.4,Eaton Vance Tax-Managed Buy-Write Income Fund Eaton Vance Ta
FCBM,452183763.0,12.65,First Carolina Financial Services Inc. Common Stock
JOUT,451878213.0,43.14,Johnson Outdoors Inc. Class A Common Stock
SRTA,451668695.0,5.22,Strata Critical Medical Inc. Class A Common Stock
MFI,451588365.0,9.0,mF International Limited Class A Ordinary Shares
BWFG,451281988.0,56.6,Bankwell Financial Group Inc. Common Stock
ALTO,450963590.0,5.82,Alto Ingredients Inc. Common Stock
WTBA,450563552.0,26.46,West Bancorporation Common Stock
BMRC,450316700.0,27.82,Bank of Marin Bancorp Common Stock
VREX,449628000.0,10.68,Varex Imaging Corporation Common Stock
NVEC,449517836.0,92.93,NVE Corporation Common Stock
BLW,449069006.0,12.57,Blackrock Limited Duration Income Trust
PANL,448752913.0,6.86,Pangaea Logistics Solutions Ltd. Common Shares
FSTR,448520492.0,42.88,L.B. Foster Company Common Stock
RBB,447446161.0,26.42,RBB Bancorp Common Stock
ERII,447227285.0,8.68,Energy Recovery Inc. Common Stock
LWAY,447224452.0,29.27,Lifeway Foods Inc. Common Stock
ELVA,446062395.0,9.01,Electrovaya Inc. Common Shares
NUAI,445690212.0,4.4,New Era Energy & Digital Inc. Common Stock
AMCX,445427000.0,10.14,AMC Global Media Inc. Class A Common Stock
ITRG,445176131.0,2.2,Integra Resources Corp. Common Shares
WILC,443401767.0,31.83,G. Willi-Food International  Ltd. Ordinary Shares
BBBY,442610490.0,5.46,Bed Bath & Beyond Inc. Common Stock
CLFD,442608712.0,32.57,Clearfield Inc. Common Stock
EPRX,440630258.0,6.75,Eupraxia Pharmaceuticals Inc. Common Stock
WDH,440144892.0,1.23,Waterdrop Inc. American Depositary Shares (each representing
DIN,439921869.0,34.68,Dine Brands Global Inc. Common Stock
RLGT,439749344.0,9.39,Radiant Logistics Inc. Common Stock
FRBA,438343988.0,17.44,First Bank Common Stock
IBEX,438091876.0,32.72,IBEX Limited Common Shares
EVN,437727144.0,11.04,Eaton Vance Municipal Income Trust Common Stock
DMAC,437532761.0,8.12,DiaMedica Therapeutics Inc. Common Stock
RMNI,436883200.0,4.72,Rimini Street Inc. (DE) Common Stock
GLAD,436498093.0,19.32,Gladstone Capital Corporation Common Stock
AUTL,436495489.0,1.64,Autolus Therapeutics plc American Depositary Share
VSTM,435765376.0,4.96,Verastem Inc. Common Stock
SI,435411498.0,21.0,Shoulder Innovations Inc. Common Stock
MAGN,434970000.0,12.15,Magnera Corporation Common Stock
MTW,434505966.0,12.1,Manitowoc Company Inc. (The) Common Stock
CDRO,431964193.0,9.5,Codere Online Luxembourg S.A. Ordinary Shares
ACTG,430787529.0,4.46,Acacia Research Corporation (Acacia Tech) Common Stock
BOC,430222359.0,14.15,Boston Omaha Corporation Class A Common Stock
BLND,429757064.0,1.77,Blend Labs Inc. Class A Common Stock
IMXI,429448401.0,14.27,International Money Express Inc. Common Stock
GRVY,429442020.0,61.8,GRAVITY Co. Ltd. American Depository Shares
IPSC,427440897.0,2.37,Century Therapeutics Inc. Common Stock
CCRN,427276115.0,13.21,Cross Country Healthcare Inc. Common Stock $0.0001 Par Value
SGU,426841129.0,13.0,Star Group L.P. Common Stock
ASPN,425633735.0,5.14,Aspen Aerogels Inc. Common Stock
MRLN,424367995.0,4.4,Merlin Inc. Common Stock
QUAD,424334874.0,8.23,Quad Graphics Inc Class A Common Stock
EBS,424121553.0,8.22,Emergent BioSolutions Inc. Common Stock
UPB,423659591.0,7.79,Upstream Bio Inc. Common Stock
CBAN,423616573.0,20.02,Colony Bankcorp Inc. Common Stock
KMDA,423415651.0,7.34,Kamada Ltd. Ordinary Shares
PBFS,423296401.0,16.88,Pioneer Bancorp Inc. Common Stock
HNST,423252275.0,3.85,The Honest Company Inc. Common Stock
AIV,422937178.0,2.94,Apartment Investment and Management Company Common Stock
CINT,422758390.0,3.28,CI&T Inc Class A Common Shares
GOTU,422042060.0,1.77,Gaotu Techedu Inc. American Depositary Shares
ZSQR,421995400.0,8.21,Z Squared Inc. Common Stock
MOBI,421098661.0,12.66,Mobia Medical Inc. Common Stock
VKI,420080949.0,9.46,Invesco Advantage Municipal Income Trust II Common Shares of
LSAK,418688355.0,4.88,Lesaka Technologies Inc. Common Stock
MRAM,417015157.0,17.79,Everspin Technologies Inc. Common Stock
FPI,416980442.0,9.56,Farmland Partners Inc. Common Stock
DDD,416594895.0,2.83,3D Systems Corporation Common Stock
ABTC,415992501.0,5.87,American Bitcoin Corp. Class A Common Stock
ENTA,415530050.0,14.29,Enanta Pharmaceuticals Inc. Common Stock
MGRD,415100240.0,14.61,Affiliated Managers Group Inc. 4.200% Junior Subordinated No
SUJA,415025754.0,10.74,Suja Life Inc. Class A Common Stock
MTLS,414060974.0,7.01,Materialise NV American Depositary Shares
NATH,413944346.0,101.1,Nathan's Famous Inc. Common Stock
FWRD,413655602.0,13.08,Forward Air Corporation Common Stock
MATV,412829536.0,7.49,Mativ Holdings Inc. Common Stock
AVBC,412566938.0,20.55,Avidia Bancorp Inc. Common Stock
CMPX,412401325.0,2.29,Compass Therapeutics Inc. Common Stock
WAVE,411579483.0,8.81,Eco Wave Power Global AB (publ) American Depositary Shares
CZNC,410648151.0,22.92,Citizens & Northern Corp Common Stock
DDT,409542530.0,26.22,Dillard's Capital Trust I
PRLD,409376878.0,5.14,Prelude Therapeutics Incorporated Common Stock
FMAO,409328229.0,29.73,Farmers & Merchants Bancorp Inc. Common Stock
NEWT,408867555.0,14.15,NewtekOne Inc. Common Stock
ALLT,408507877.0,8.35,Allot Ltd. Ordinary Shares
PBYI,406686653.0,7.99,Puma Biotechnology Inc Common Stock
CCAP,406226621.0,11.03,Crescent Capital BDC Inc. Common stock
USNA,405355407.0,21.95,USANA Health Sciences Inc. Common Stock
TITN,404991888.0,17.38,Titan Machinery Inc. Common Stock
EH,404914826.0,5.62,EHang Holdings Limited ADS
SHOE,404826002.0,14.91,Shoe Station Group Inc. Common Stock
