ticker,mcap_usd,price,name
COLL,1134209252.0,34.97,Collegium Pharmaceutical Inc. Common Stock
GOLD,1133200892.0,39.07,Gold.com Inc. Common Stock
DFIN,1130202645.0,45.24,Donnelley Financial Solutions Inc. Common Stock 
UPWK,1129573363.0,9.14,Upwork Inc. Common Stock
EDN,1129037119.0,24.95,Empresa Distribuidora Y Comercializadora Norte S.A. (Edenor)
MBC,1128824084.0,8.82,MasterBrand Inc. Common Stock
PSEC,1127267219.0,2.25,Prospect Capital Corporation Common Stock
UTZ,1124469567.0,7.82,Utz Brands Inc Class A Common Stock 
TNDM,1121821187.0,16.37,Tandem Diabetes Care Inc. Common Stock
DSL,1120435156.0,10.98,DoubleLine Income Solutions Fund Common Shares of Beneficial
ITRN,1117919728.0,56.2,Ituran Location and Control Ltd. Ordinary Shares
LAC,1116263381.0,3.2,Lithium Americas Corp. Common Shares
LFMDP,1116206731.0,23.08,LifeMD Inc. 8.875% Series A Cumulative Perpetual Preferred S
ARHS,1111089502.0,7.85,Arhaus Inc. Class A Common Stock
NHP,1108883164.0,15.21,National Healthcare Properties Inc. Class A Common Stock
SAFT,1108847417.0,75.52,Safety Insurance Group Inc. Common Stock
BTZ,1105139700.0,10.22,BlackRock Credit Allocation Income Trust
IQ,1104953322.0,1.15,iQIYI Inc. American Depositary Shares
SIFY,1103903533.0,15.24,Sify Technologies Limited American Depositary Shares
CRML,1103868979.0,7.51,Critical Metals Corp. Ordinary Shares
FUBO,1102796927.0,10.17,FuboTV Inc. Class A Common Stock
LMRI,1101085223.0,11.46,Lumexa Imaging Holdings Inc. Common Stock
GNK,1100756308.0,25.26,Genco Shipping & Trading Limited Ordinary Shares New (Marsha
SCSC,1100573245.0,54.15,ScanSource Inc. Common Stock
THRM,1100342365.0,35.88,Gentherm Inc Common Stock
OCFC,1100161318.0,19.1,OceanFirst Financial Corp. Common Stock
USPH,1100014069.0,72.28,U.S. Physical Therapy Inc. Common Stock
XNCR,1099149161.0,14.82,Xencor Inc. Common Stock
DRTS,1094841128.0,12.44,Alpha Tau Medical Ltd. Ordinary Shares
JBGS,1094619268.0,14.69,JBG SMITH Properties Common Shares 
RHLD,1092046705.0,132.25,Resolute Holdings Management Common Stock 
TUYA,1091649265.0,1.78,Tuya Inc. American Depositary Shares each representing one C
PZZA,1090701764.0,33.15,Papa John's International Inc. Common Stock
GOODN,1090609552.0,22.53,Gladstone Commercial Corporation 6.625% Series E Cumulative 
ENVX,1089676433.0,5.0,Enovix Corporation Common Stock
CGEM,1088421995.0,17.71,Cullinan Therapeutics Inc. Common Stock
NMAX,1085595221.0,8.4,Newsmax Inc. Class B Common Stock
CERT,1085063141.0,6.97,Certara Inc. Common Stock
EVLV,1083725245.0,6.03,Evolv Technologies Holdings Inc. Class A Common Stock
APEI,1082816097.0,59.03,American Public Education Inc. Common Stock
ORIC,1082793699.0,10.46,Oric Pharmaceuticals Inc. Common Stock
WLDN,1082674920.0,71.65,Willdan Group Inc. Common Stock
PDS,1081628923.0,83.58,Precision Drilling Corporation Common Stock
FINV,1081310529.0,4.58,FinVolution Group American Depositary Shares
CIM,1081283710.0,12.93,Chimera Investment Corporation Common Stock
SPTX,1080781805.0,20.19,Seaport Therapeutics Inc. Common Stock
ADTN,1078489702.0,13.31,ADTRAN Holdings Inc. Common Stock
CFFN,1077543530.0,8.5,Capitol Federal Financial Inc. Common Stock
ABX,1077208181.0,11.23,Abacus Global Management Inc. Class A Common Stock
LU,1074694226.0,1.24,Lufax Holding Ltd American Depositary Shares each representi
SBR,1074643520.0,73.71,Sabine Royalty Trust Common Stock
PTA,1072305066.0,19.4,Cohen & Steers Tax-Advantaged Preferred Securities and Incom
CRAI,1072250319.0,165.91,CRA International Inc. Common Stock
HEPS,1066317222.0,2.98,D-Market Electronic Services & Trading American Depositary S
LUXE,1065082939.0,7.81,LuxExperience B.V. American Depositary Shares each represent
OCSL,1064073118.0,12.08,Oaktree Specialty Lending Corporation Common Stock
JCAP,1061817828.0,19.16,Jefferson Capital Inc. Common Stock
ASST,1060234825.0,11.81,Strive Inc. Class A Common Stock
AOSL,1060105653.0,35.42,Alpha and Omega Semiconductor Limited Common Shares
NBN,1058688600.0,130.22,Northeast Bank Common Stock
DEC,1058469253.0,13.79,Diversified Energy Company Common Stock
HTFC,1058112032.0,24.87,Horizon Technology Finance Corporation 6.25% Notes due 2027
VZLA,1057233976.0,3.02,Vizsla Silver Corp. Common Shares
ETW,1052686735.0,9.61,Eaton Vance Corporation Eaton Vance Tax-Managed Global Buy-W
JBIO,1052599334.0,21.32,Jade Biosciences Inc. Common Stock
RCAT,1050674610.0,8.56,Red Cat Holdings Inc. Common Stock
BST,1048067575.0,47.3,BlackRock Science and Technology Trust Common Shares of Bene
MUX,1041667867.0,17.38,McEwen Inc. Common Stock
SBGI,1040627678.0,14.42,Sinclair Inc. Class A Common Stock
OLMA,1036814481.0,11.87,Olema Pharmaceuticals Inc. Common Stock
BAK,1036370184.0,2.6,Braskem SA ADR
ALVO,1034787739.0,3.31,Alvotech Ordinary Shares
CRON,1034711444.0,2.75,Cronos Group Inc. Common Share
GDRX,1034653265.0,3.06,GoodRx Holdings Inc. Class A Common Stock
ELVR,1034383934.0,61.07,Elevra Lithium Limited American Depository Shares
LUCK,1034229963.0,7.57,Lucky Strike Entertainment Corporation Class A Common Stock
VRTS,1034192022.0,154.77,Virtus Investment Partners Inc. Common Stock
BOW,1032099440.0,31.43,Bowhead Specialty Holdings Inc. Common Stock
ENHA,1031642059.0,2.71,Enhanced Group Inc. Class A Common Stock
JBSS,1031546546.0,88.25,John B. Sanfilippo & Son Inc. Common Stock
ACEL,1028806256.0,12.64,Accel Entertainment Inc. 
SBSI,1027329556.0,34.53,Southside Bancshares Inc. Common Stock
DCBG,1025694289.0,26.2,Dime Commercial Bancshares Inc. 9.000% Junior Subordinated N
CSIQ,1025388867.0,15.12,Canadian Solar Inc. Common Shares (ON)
MSEX,1023965608.0,54.98,Middlesex Water Company Common Stock
RZLV,1023681628.0,2.56,Rezolve AI PLC Ordinary Shares
MCBS,1022303698.0,35.67,MetroCity Bankshares Inc. Common Stock
SANA,1018547219.0,3.66,Sana Biotechnology Inc. Common Stock
FSBC,1017611764.0,47.6,Five Star Bancorp Common Stock
ESQ,1016688240.0,117.68,Esquire Financial Holdings Inc. Common Stock
SCHL,1014064417.0,46.64,Scholastic Corporation Common Stock
RNP,1013729896.0,20.63,Cohen & Steers REIT and Preferred and Income Fund Inc. Commo
PCRX,1011044907.0,25.7,Pacira BioSciences Inc. Common Stock
EVC,1005988237.0,10.93,Entravision Communications Corporation Common Stock
BIOA,1005965370.0,22.63,BioAge Labs Inc. Common Stock
VMET,1004755235.0,9.31,Versamet Royalties Corporation Common Stock
CRSR,1004692783.0,9.4,Corsair Gaming Inc. Common Stock
BVS,1004088116.0,12.02,Bioventus Inc. Class A Common Stock
BLZE,1003860000.0,16.73,Backblaze Inc. Class A Common Stock
CPAC,1003720490.0,11.84,Cementos Pacasmayo S.A.A. American Depositary Shares (Each r
HBNC,1003496886.0,19.55,Horizon Bancorp Inc. Common Stock
GSBD,1002427542.0,8.9,Goldman Sachs BDC Inc. Common Stock
LWLG,1001811473.0,6.5,Lightwave Logic Inc. Common Stock
HQH,999899493.0,21.12,abrdn Healthcare Investors Shares of Beneficial Interest
CPF,999155046.0,38.28,Central Pacific Financial Corp New
EQBK,999013655.0,48.4,Equity Bancshares Inc. Class A Common Stock
ETON,998725373.0,36.46,Eton Pharmaceuticals Inc. Common Stock
EEX,995484599.0,5.03,Emerald Holding Inc. Common Stock
QNST,994953808.0,17.32,QuinStreet Inc. Common Stock
CCNE,993164516.0,33.52,CNB Financial Corporation Common Stock
TROX,993037485.0,6.22,Tronox Holdings plc Ordinary Shares (UK)
KFRC,992707440.0,55.67,Kforce Inc. Common Stock
MBWM,988439738.0,57.22,Mercantile Bank Corporation Common Stock
BFST,987201413.0,30.21,Business First Bancshares Inc. Common Stock
ELE,986348020.0,15.32,Elemental Royalty Corporation Common Stock
BCX,986050076.0,11.62,BlackRock Resources Common Shares of Beneficial Interest
PSF,985720878.0,20.06,Cohen & Steers Select Preferred and Income Fund Inc. Common 
KURA,985395452.0,11.1,Kura Oncology Inc. Common Stock
GO,985269813.0,9.96,Grocery Outlet Holding Corp. Common Stock
ROOT,984791269.0,62.23,Root Inc. Class A Common Stock
DAKT,983562272.0,20.37,Daktronics Inc. Common Stock
SG,983298862.0,8.28,Sweetgreen Inc. Class A Common Stock
COUR,981287262.0,5.79,Coursera Inc. Common Stock
JANX,980628412.0,16.08,Janux Therapeutics Inc. Common Stock
ASM,980356666.0,5.76,Avino Silver & Gold Mines Ltd. Common Shares (Canada)
PSUS,978010000.0,37.4,Pershing Square USA Ltd. Common Shares
FMN,976404902.0,11.32,Federated Hermes Premier Municipal Income Fund
AMTB,975944577.0,25.37,Amerant Bancorp Inc. Class A Common Stock
WSR,975714653.0,18.98,Whitestone REIT Common Shares
LXRX,975011076.0,2.19,Lexicon Pharmaceuticals Inc. Common Stock
PLOW,974611217.0,42.15,Douglas Dynamics Inc. Common Stock
OPK,974069010.0,1.29,OPKO Health Inc. Common Stock
AVTX,972988738.0,18.51,Avalo Therapeutics Inc. Common Stock
AEF,972704250.0,9.06,abrdn Emerging Markets ex-China Fund Inc. Common Stock
RDVT,972316291.0,68.92,Red Violet Inc. Common Stock 
GOODO,971528350.0,20.07,Gladstone Commercial Corporation 6.00% Series G Cumulative R
FRBT,969652890.0,19.52,Forbright Inc. Class A Common Stock
UTL,969344897.0,53.88,UNITIL Corporation Common Stock
VOR,967759763.0,17.86,Vor Biopharma Inc. Common Stock
INMD,967488113.0,15.27,InMode Ltd. Ordinary Shares
ARRY,962183994.0,6.25,Array Technologies Inc. Common Stock
ODD,959197677.0,16.93,ODDITY Tech Ltd. Class A Ordinary Shares
FSCO,959050777.0,4.83,FS Credit Opportunities Corp. Common Stock
HAFC,955651396.0,32.1,Hanmi Financial Corporation Common Stock
MFA,955004581.0,9.4,MFA Financial Inc.
NNE,954947195.0,18.34,Nano Nuclear Energy Inc. Common Stock
TRST,952726696.0,54.52,TrustCo Bank Corp NY Common Stock
ABR,952187955.0,4.95,Arbor Realty Trust Common Stock
SLDB,952007690.0,9.67,Solid Biosciences Inc. Common Stock
CRCT,951890305.0,4.54,Cricut Inc. Class A Common Stock
INDI,949592144.0,4.18,indie Semiconductor Inc. Class A Common Stock
SIGIP,949530587.0,15.86,Selective Insurance Group Inc. Depositary Shares each repres
GOOS,948783416.0,9.71,Canada Goose Holdings Inc. Subordinate Voting Shares
AIZN,948633167.0,18.8,Assurant Inc. 5.25% Subordinated Notes due 2061
BBSI,948248048.0,38.61,Barrett Business Services Inc. Common Stock
ESRT,947503987.0,5.5,Empire State Realty Trust Inc. Class A Common Stock
PDX,946894260.0,21.18,PIMCO Dynamic Income Strategy Fund Common Shares of Benefici
BKSY,946651253.0,25.51,BlackSky Technology Inc. Class A Common Stock
PHAR,942846821.0,13.35,Pharming Group N.V. ADS each representing 10 ordinary shares
TK,942414858.0,10.86,Teekay Corporation Ltd. Common Stock
CSR,941482119.0,56.03,D/B/A Centerspace Common Stock
VLRS,941186960.0,8.1,Controladora Vuela Compania de Aviacion S.A.B. de C.V. Ameri
BRUNW,939858712.0,15.3,Boost Run Inc. Warrant
NBBK,938829423.0,21.0,NB Bancorp Inc. Common Stock
AEBI,938564549.0,12.1,Aebi Schmidt Holding AG Common Stock 
BUR,937607667.0,4.29,Burford Capital Limited Ordinary Shares
ASA,933800498.0,51.26,ASA  Gold and Precious Metals Limited
DBVT,933131707.0,15.76,DBV Technologies S.A. American Depositary Shares
ABUS,932377991.0,4.72,Arbutus Biopharma Corporation Common Stock
ACDC,931741878.0,5.15,ProFrac Holding Corp. Class A Common Stock
EIG,930936259.0,51.03,Employers Holdings Inc Common Stock
ANNX,930625616.0,5.68,Annexon Inc. Common Stock
HSLV,929645020.0,4.57,Highlander Silver Corp. Common Shares
HPK,927468483.0,7.34,HighPeak Energy Inc. Common Stock
GERN,926997807.0,1.45,Geron Corporation Common Stock
LBRX,926829393.0,32.32,LB Pharmaceuticals Inc Common Stock
AVR,926697773.0,9.52,Anteris Technologies Global Corp. Common Stock
FTK,924334691.0,25.55,Flotek Industries Inc. Common Stock
ENRD,922659021.0,6.4,Einride AB American Depositary Shares
MBINN,922382993.0,20.08,Merchants Bancorp Depositary Shares Preferred Series C
GTM,920993856.0,3.12,ZoomInfo Technologies Inc Common Stock
RWAYL,917367289.0,25.33,Runway Growth Finance Corp. 7.50% Notes due 2027
GAINZ,917261520.0,24.0,Gladstone Investment Corporation 4.875% Notes due 2028
GLAS,915440236.0,11.65,Glass House Brands Inc. Subordinate Voting Shares
KBDC,914303028.0,13.78,Kayne Anderson BDC Inc. Common Stock
ARKO,913752698.0,8.14,ARKO Corp. Common Stock
IVA,913362666.0,4.37,Inventiva S.A. American Depository Shares
NAK,913251163.0,1.63,Northern Dynasty Minerals Ltd. Common Stock
KOP,912707845.0,47.46,Koppers Holdings Inc. Common Stock
PHAT,911610543.0,11.43,Phathom Pharmaceuticals Inc. Common Stock
TBN,911585681.0,32.19,Tamboran Resources Corporation Common stock
BHFAL,911090150.0,15.86,Brighthouse Financial Inc. 6.25% Junior Subordinated Debentu
GRPN,909716321.0,23.95,Groupon Inc. Common Stock
MOMO,906430305.0,6.13,Hello Group Inc. American Depositary Shares
AIO,906429956.0,26.39,Virtus Artificial Intelligence & Technology Opportunities Fu
UAMY,906155079.0,6.12,United States Antimony Corporation Common Stock
NXDR,905795847.0,2.38,Nextdoor Holdings Inc. Class A Common Stock
CAC,905611967.0,53.54,Camden National Corporation Common Stock
GLIBA,903249539.0,22.64,Liberty Capital Corporation Series A GCI Group Common Stock
WRLD,903006856.0,194.6,World Acceptance Corporation Common Stock
ANRO,900071826.0,25.65,Alto Neuroscience Inc. Common Stock
BLDP,898458325.0,2.98,Ballard Power Systems Inc. Common Shares
TCBIO,898311215.0,20.57,Texas Capital Bancshares Inc. Depositary Shares 5.75% Fixed 
GLIBK,895069015.0,22.43,Liberty Capital Corporation Series C GCI Group Common Stock
AHG,893352873.0,1.62,Akso Health Group ADS
BBDC,893149721.0,8.53,Barings BDC Inc. Common Stock
DSGN,891104877.0,14.27,Design Therapeutics Inc. Common Stock
NPK,889281483.0,124.14,National Presto Industries Inc. Common Stock
THFF,889275983.0,74.78,First Financial Corporation Common Stock
BFS,888930005.0,36.23,Saul Centers Inc. Common Stock
LANDP,888613404.0,20.6,Gladstone Land Corporation 6.00% Series C Cumulative Redeema
HMH,886208819.0,20.14,HMH Holding Inc. Class A Common Stock
SUPV,886041301.0,9.7,Grupo Supervielle S.A. American Depositary Shares each Repre
GILT,886028930.0,11.74,Gilat Satellite Networks Ltd. Ordinary Shares
LANDO,885529139.0,20.53,Gladstone Land Corporation 6.00% Series B Cumulative Redeema
EVER,885216282.0,25.02,EverQuote Inc. Class A Common Stock
BANFP,884527729.0,26.34,BancFirst Corporation - BFC Capital Trust II Cumulative Trus
KDK,884341936.0,4.43,Kodiak AI Inc. Common Stock 
LYTS,884034688.0,24.08,LSI Industries Inc. Common Stock
BH,880558251.0,383.8,Biglari Holdings Inc. Class B Common Stock
PMT,878563797.0,10.07,PennyMac Mortgage Investment Trust Common Shares of Benefici
TALK,876928283.0,5.24,Talkspace Inc. Common Stock
MITK,876533298.0,19.41,Mitek Systems Inc. Common Stock
FTH,876477636.0,34.0,Faeth Therapeutics Inc. Common Stock
MPB,876428094.0,34.58,Mid Penn Bancorp Common Stock
RERE,875963659.0,4.0,ATRenew Inc. American Depositary Shares (every three of whic
DJTWW,875174096.0,3.16,Trump Media & Technology Group Corp. Warrants
TBPH,872792375.0,16.93,Theravance Biopharma Inc. Ordinary Shares
LMB,871251182.0,73.08,Limbach Holdings Inc. Common Stock
TIGR,869771456.0,4.58,UP Fintech Holding Ltd American Depositary Share representin
IQMXW,868697598.0,4.52,IQM Quantum Computers Oyj Warrants to purchase American Depo
BZH,867302267.0,31.73,Beazer Homes USA Inc. Common Stock
CAPL,866866400.0,22.72,CrossAmerica Partners LP Common Units representing limited p
MAX,866670866.0,13.9,MediaAlpha Inc. Class A Common Stock
DSP,866030779.0,13.21,Viant Technology Inc. Class A Common Stock
UMAC,861915607.0,18.03,Unusual Machines Inc. Common Stock
BHFAO,859963401.0,14.97,Brighthouse Financial Inc. Depositary Shares 6.75% Non-Cumul
HIVE,859790090.0,3.21,HIVE Digital Technologies Ltd. Common Shares
RJET,857916000.0,18.32,Republic Airways Holdings Inc. Common Stock
GENVR,855456073.0,1.42,Gen Digital Inc. Contingent Value Rights
AMPH,853197983.0,19.35,Amphastar Pharmaceuticals Inc. Common Stock
ADSE,852864294.0,11.85,ADS-TEC ENERGY PLC Ordinary Shares
HRTG,852529393.0,28.09,Heritage Insurance Holdings Inc. Common Stock
MOV,850636207.0,38.27,Movado Group Inc. Common Stock
JMIA,849628857.0,6.86,Jumia Technologies AG American Depositary Shares each repres
RPC,849538323.0,7.76,Ridgepost Capital Inc. Class A Common Stock
DGICB,848439614.0,22.9,Donegal Group Inc. Class B Common Stock
REPL,848265852.0,10.11,Replimune Group Inc. Common Stock
IPX,847442023.0,24.97,IperionX Limited American Depositary Share
WOOF,847192809.0,2.62,Petco Health and Wellness Company Inc. Class A Common Stock
FMNB,847070875.0,14.3,Farmers National Banc Corp. Common Stock
HSTM,846510072.0,28.98,HealthStream Inc. Common Stock
CCBG,845149923.0,49.42,Capital City Bank Group Common Stock
TRNS,844772727.0,90.44,Transcat Inc. Common Stock
BHFAP,844165811.0,14.7,Brighthouse Financial Inc. Depositary Shares 6.6% Non-Cumula
FBRX,841884167.0,41.11,Forte Biosciences Inc. Common Stock
PD,841407184.0,10.91,PagerDuty Inc. Common Stock
WGO,840999567.0,29.75,Winnebago Industries Inc. Common Stock
GSBC,840301679.0,77.14,Great Southern Bancorp Inc. Common Stock
SMP,839214302.0,37.7,Standard Motor Products Inc. Common Stock
MTAL,838638886.0,10.17,Metals Acquisition Corp. II Class A Ordinary Shares
MNTN,834014141.0,10.69,MNTN Inc. Class A Common Stock
MATW,830920924.0,26.63,Matthews International Corporation Class A Common Stock
ODTX,830461523.0,17.29,Odyssey Therapeutics Inc. Common Stock
METC,830132138.0,12.49,Ramaco Resources Inc. Class A Common Stock
INR,829408132.0,13.05,Infinity Natural Resources Inc. Class A Common Stock
FCBC,828060736.0,43.89,First Community Bankshares Inc. (VA) Common Stock
HPP,825563605.0,15.22,Hudson Pacific Properties Inc. Common Stock
BCSF,823830039.0,12.7,Bain Capital Specialty Finance Inc. Common Stock
SMBC,822206772.0,74.64,Southern Missouri Bancorp Inc. Common Stock
YALA,819876530.0,5.4,Yalla Group Limited American Depositary Shares each represen
CCU,819557366.0,11.09,Compania Cervecerias Unidas S.A. Common Stock
ESPR,819464843.0,3.18,Esperion Therapeutics Inc. Common Stock
LXU,819383445.0,11.39,LSB Industries Inc. Common Stock
HTB,819260813.0,48.75,HomeTrust Bancshares Inc. Common Stock
MTUS,819235222.0,19.68,Metallus Inc. Common Shares
NABL,818503670.0,4.34,N-able Inc. Common Stock
JKS,818284188.0,15.62,JinkoSolar Holding Company Limited American Depositary Share
GMRS,818277422.0,15.15,GMR Solutions Inc. Class A Common Stock
HCMA,818024178.0,10.32,HCM III Acquisition Corp. Class A Ordinary Share
PGC,817880328.0,46.16,Peapack-Gladstone Financial Corporation Common Stock
SPFI,814843290.0,42.56,South Plains Financial Inc. Common Stock
EGBN,813318079.0,26.67,Eagle Bancorp Inc. Common Stock
CYRX,809965170.0,16.07,CryoPort Inc. Common Stock
ADAM,809648583.0,9.01,Adamas Trust Inc. Common Stock
MFIC,808899207.0,9.82,MidCap Financial Investment Corporation Common Stock
RUMBW,806375390.0,1.85,RUM Group Inc. Warrant
SOUNW,804951521.0,1.86,SoundHound AI Inc. Warrant
CTMX,804412286.0,3.69,CytomX Therapeutics Inc. Common Stock
HDL,801818667.0,12.33,SUPER HI INTERNATIONAL HOLDING LTD. American Depositary Shar
SDHC,801358170.0,15.78,Smith Douglas Homes Corp. Class A Common Stock
KODK,800418083.0,8.18,Eastman Kodak Company Common New
SIBN,799617572.0,18.03,SI-BONE Inc. Common Stock
TDUP,799408041.0,6.2,ThredUp Inc. Class A Common Stock
DQ,799137078.0,11.81,DAQO New Energy Corp. American Depositary Shares each repres
EVEX,797617497.0,2.29,Eve Holding Inc. Common Stock
APOG,797481855.0,38.22,Apogee Enterprises Inc. Common Stock
VTEX,796671900.0,4.18,VTEX Class A Common Shares
SOC,796046613.0,4.36,Sable Offshore Corp. Common Stock
DJCO,794242956.0,576.49,Daily Journal Corp. (S.C.) Common Stock
SMBK,793711117.0,46.42,SmartFinancial Inc. Common Stock
ORRF,793180206.0,40.37,Orrstown Financial Services Inc. Common Stock
HNRG,788255806.0,16.73,Hallador Energy Company Common Stock
NAVI,786612466.0,8.37,Navient Corporation Common Stock
ALRS,784767615.0,31.23,Alerus Financial Corporation Common Stock
WLKP,782458514.0,22.2,Westlake Chemical Partners LP Common Units representing limi
OPFI,781775185.0,9.15,OppFi Inc. Class A Common Stock
OFRM,781053858.0,18.64,Once Upon a Farm PBC Common Stock
ZVRA,780910260.0,13.21,Zevra Therapeutics Inc. Common Stock
RSKD,780299936.0,5.26,Riskified Ltd. Class A Ordinary Shares
OCS,779310847.0,13.44,Oculis Holding AG Ordinary shares
RPD,778576700.0,11.65,Rapid7 Inc. Common Stock
MAMA,777483548.0,18.99,Mama's Creations Inc. Common Stock
NX,775723329.0,16.89,Quanex Building Products Corporation Common Stock
RIGL,774682090.0,41.87,Rigel Pharmaceuticals Inc. Common Stock
CLYM,770187659.0,13.45,Climb Bio Inc. Common Stock
OIO,769128859.0,2.21,OIO Group Ordinary Shares
CRESY,768119873.0,10.83,Cresud S.A.C.I.F. y A. American Depositary Shares
HIPO,767929372.0,29.5,Hippo Holdings Inc. Common Stock
FWRG,767478818.0,12.45,First Watch Restaurant Group Inc. Common Stock
EFOR,765889488.0,18.61,Everforth Inc. Common Stock
GFR,763862610.0,6.09,Greenfire Resources Ltd. Common Shares
RILYN,763280568.0,25.03,BRC Group Holdings Inc. 6.50% Senior Notes Due 2026
GDOT,763199768.0,13.46,Green Dot Corporation Class A Common Stock $0.001 par value
FDUS,762882716.0,20.1,Fidus Investment Corporation Common Stock
BBNX,761559368.0,17.09,Beta Bionics Inc. Common Stock
CBLL,761130562.0,20.06,CeriBell Inc. Common Stock
FPH,761078367.0,5.12,Five Point Holdings LLC Class A Common Shares
FISI,760779769.0,38.65,Financial Institutions Inc. Common Stock
ACRS,760468738.0,5.45,Aclaris Therapeutics Inc. Common Stock
ANGX,755902136.0,4.05,Angel Studios Inc. Class A Common Stock
KELYB,755788342.0,21.8,Kelly Services Inc. Class B Common Stock
MITP,755020390.0,25.6,TPG Mortgage Investment Trust Inc. 9.500% Senior Notes due 2
SPRY,754704791.0,7.6,ARS Pharmaceuticals Inc. Common Stock
HZO,754574415.0,34.26,MarineMax Inc.  (FL) Common Stock
SHBI,753427566.0,22.52,Shore Bancshares Inc Common Stock
MITN,752071092.0,25.5,TPG Mortgage Investment Trust Inc. 9.500% Senior Notes due 2
KRO,751872113.0,6.54,Kronos Worldwide Inc Common Stock
SKYH,750739131.0,9.81,Sky Harbour Group Corporation Class A Common Stock
RILYG,748699921.0,24.55,BRC Group Holdings Inc. 5.00% Senior Notes due 2026
IMMX,746759591.0,10.7,Immix Biopharma Inc. Common Stock
CODI,745212243.0,9.9,D/B/A Compass Diversified Holdings Shares of Beneficial Inte
NGVC,744563000.0,32.31,Natural Grocers by Vitamin Cottage Inc. Common Stock
AGNT,744387376.0,4.53,AGNT Inc. Common Stock
SSII,743488653.0,3.71,SS Innovations International Inc. Common Stock
PSIX,742454995.0,32.21,Power Solutions International Inc. Common Stock
FAC,741135972.0,6.92,Factorial Energy Inc. Class A Common Stock
REPX,738963955.0,34.06,Riley Exploration Permian Inc. Common Stock
NIE,738721007.0,26.66,Virtus Equity & Convertible Income Fund Common Shares of Ben
IBCP,738627698.0,35.84,Independent Bank Corporation Common Stock
HOV,738104136.0,125.97,Hovnanian Enterprises Inc. Class A Common Stock
CCNEP,737880940.0,24.9,CNB Financial Corporation Depositary Shares each representin
TXO,736106406.0,13.32,TXO Partners L.P. Common Units Representing Limited Partner 
KRNT,734033156.0,15.84,Kornit Digital Ltd. Ordinary Shares
IBTA,733627023.0,31.52,Ibotta Inc. Class A Common Stock
CGBD,733517364.0,10.46,Carlyle Secured Lending Inc. Common Stock
EFSCP,731716100.0,20.0,Enterprise Financial Services Corporation Depositary Shares 
CWBC,730995510.0,26.94,Community West Bancshares Common Stock
ALOY,730809611.0,10.62,REalloys Inc. Common Stock
AIAI,728452936.0,10.36,AIAI Holdings Corporation Class A Common Stock
IVR,728198545.0,7.84,INVESCO MORTGAGE CAPITAL INC Common Stock
PKE,727488997.0,34.84,Park Aerospace Corp. Common Stock
NEWP,727343037.0,3.93,New Pacific Metals Corp. Common Shares
FOXF,726333824.0,17.32,Fox Factory Holding Corp. Common Stock
ONT,726037070.0,20.09,Onterris Inc. Common Stock
NGNE,725635237.0,37.96,Neurogene Inc. Common Stock 
SSYS,725141916.0,8.41,Stratasys Ltd. Ordinary Shares (Israel)
OMER,724839180.0,10.02,Omeros Corporation Common Stock
BLMN,723440725.0,8.45,Bloomin' Brands Inc. Common Stock
CTO,722968869.0,21.4,CTO Realty Growth Inc. Common Stock
NEWTP,721989839.0,24.99,NewtekOne Inc. Depositary Shares Non-Cumulative Perpetual Pr
PAR,721189790.0,17.48,PAR Technology Corporation Common Stock
WEST,721148455.0,7.39,Westrock Coffee Company Common Stock
VBNK,720861656.0,22.39,VersaBank Common Shares
DRUG,720107157.0,73.39,Bright Minds Biosciences Inc. Common Stock
ODV,719142452.0,2.36,Osisko Development Corp. Common Shares
SABR,717493590.0,1.81,Sabre Corporation Common Stock
GEGGL,715495719.0,24.68,Great Elm Group Inc.  7.25% Notes due 2027
SXC,714039661.0,8.41,SunCoke Energy Inc. Common Stock
LPTH,713915558.0,11.37,LightPath Technologies Inc. Class A Common Stock
AURA,713711270.0,6.9,Aura Biosciences Inc. Common Stock
CADL,709988616.0,9.69,Candel Therapeutics Inc. Common Stock
TMS,709507421.0,7.85,Teamshares Inc. Common Stock
HSHP,709197500.0,15.17,Himalaya Shipping Ltd. Common Shares
INN,708165785.0,6.54,Summit Hotel Properties Inc. Common Stock
SHEN,708121613.0,12.8,Shenandoah Telecommunications Co Common Stock
JBI,707194900.0,5.18,Janus International Group Inc. Common Stock
PFLT,706828291.0,7.12,PennantPark Floating Rate Capital Ltd. Common Stock
SLRC,706482510.0,12.95,SLR Investment Corp. Common Stock
NXRT,706367775.0,27.71,NexPoint Residential Trust Inc. Common Stock
LOT,706298863.0,1.1,Lotus Technology Inc. American Depositary Shares
CARE,706215478.0,31.78,Carter Bankshares Inc. Common Stock
SWBI,705569498.0,15.78,Smith & Wesson Brands Inc. Common Stock
GYRE,705166970.0,6.33,Gyre Therapeutics Inc. Common Stock
IRWD,704545378.0,4.28,Ironwood Pharmaceuticals Inc. Class A Common Stock
SB,704466548.0,6.89,Safe Bulkers Inc Common Stock ($0.001 par value)
PRAA,704271497.0,18.46,PRA Group Inc. Common Stock
SWIM,703295418.0,5.99,Latham Group Inc. Common Stock
DGICA,703201465.0,18.98,Donegal Group Inc. Class A Common Stock
CCSI,702433731.0,38.18,Consensus Cloud Solutions Inc. Common Stock
MNPR,701525773.0,104.72,Monopar Therapeutics Inc. Common Stock
VRRM,701049204.0,4.62,Verra Mobility Corporation Class A Common Stock
TBLD,700507915.0,21.84,Thornburg Income Builder Opportunities Trust Common Stock
CSTL,699408693.0,23.06,Castle Biosciences Inc. Common Stock
BWMX,696461304.0,18.7,Betterware de Mexico S.A.P.I. de C.V. Ordinary Shares
