ticker,mcap_usd,price,name
CUBB,693345018.0,21.93,Customers Bancorp Inc 5.375% Subordinated Notes Due 2034
HYLN,691018055.0,3.88,Hyliion Holdings Corp. Class A Common Stock
TIPT,690913679.0,18.39,Tiptree Inc. Common Stock
ANL,690343545.0,9.47,Adlai Nortye Ltd. American Depositary Shares
KRT,689946543.0,34.56,Karat Packaging Inc. Common Stock
PHR,689202562.0,11.15,Phreesia Inc. Common Stock
BHFAN,688774962.0,11.99,Brighthouse Financial Inc. Depositary shares each representi
MEC,686959081.0,33.52,Mayville Engineering Company Inc. Common Stock
BRSP,683959841.0,5.25,BrightSpire Capital Inc. Class A Common Stock
WHK,683571959.0,26.32,WhiteHawk Minerals Corp Class A Common Stock
FOF,681773894.0,13.87,Cohen & Steers Closed-End Opportunity Fund Inc. Common Stock
WASH,681594950.0,35.75,Washington Trust Bancorp Inc. Common Stock
VEL,678924010.0,17.3,Velocity Financial Inc. Common Stock
KOPN,677719749.0,3.71,Kopin Corporation Common Stock
DLY,676994399.0,14.12,DoubleLine Yield Opportunities Fund Common Shares of Benefic
BBOT,676905029.0,8.45,BridgeBio Oncology Therapeutics Inc. Common Stock  
SGP,675520938.0,20.2,SpyGlass Pharma Inc. Common Stock
RLMD,675493036.0,6.44,Relmada Therapeutics Inc. Common Stock
NEWTG,675418722.0,25.66,NewtekOne Inc. 8.50% Fixed Rate Senior Notes due 2029
MCS,675408759.0,21.98,Marcus Corporation (The) Common Stock
AROW,672731073.0,40.7,Arrow Financial Corporation Common Stock
CASS,671745266.0,52.19,Cass Information Systems Inc Common Stock
EVH,671511970.0,5.97,Evolent Health Inc Class A Common Stock
BCAL,669671636.0,20.82,California BanCorp Common Stock
TCMD,669469797.0,29.68,Tactile Systems Technology Inc. Common Stock
NXP,669395793.0,14.3,Nuveen Select Tax Free Income Portfolio Common Stock
NEWTI,669101478.0,25.42,NewtekOne Inc. 8.00% Fixed Rate Senior Notes due 2028
NMFC,667306135.0,7.07,New Mountain Finance Corporation Common Stock
TCBX,667167175.0,40.21,Third Coast Bancshares Inc. Common Stock
VMO,666907446.0,9.89,Invesco Municipal Opportunity Trust Common Stock
CCOI,665281753.0,13.29,Cogent Communications Holdings Inc.
PSTL,665182501.0,24.08,Postal Realty Trust Inc. Class A Common Stock
RSVR,665153163.0,10.13,Reservoir Media Inc. Common Stock
ALLO,664422530.0,1.93,Allogene Therapeutics Inc. Common Stock
YB,663554894.0,14.4,Yuanbao Inc. American Depositary Shares
CGNT,663531469.0,9.13,Cognyte Software Ltd. Ordinary Shares
PFIS,663320975.0,66.26,Peoples Financial Services Corp. Common Stock
BALY,662766684.0,13.54,Bally's Corporation Common Stock
VTS,661559045.0,15.86,Vitesse Energy Inc. Common Stock
GAIN,658257115.0,16.53,Gladstone Investment Corporation Business Development Compan
MTA,657369831.0,7.04,Metalla Royalty & Streaming Ltd. Common Shares
ASC,657003691.0,16.1,Ardmore Shipping Corporation Common Stock
HELE,656836120.0,28.2,Helen of Troy Limited Common Stock
RGNX,656042810.0,12.69,REGENXBIO Inc. Common Stock
ISOU,655023244.0,10.04,IsoEnergy Ltd. Common Shares
SATL,654497688.0,4.42,Satellogic Inc. Class A Common Stock
TRTX,654027448.0,8.46,TPG RE Finance Trust Inc. Common Stock
AMSF,653979223.0,34.97,AMERISAFE Inc. Common Stock
CRMD,653504252.0,8.33,CorMedix Inc. Common Stock
TECX,652402106.0,34.58,Tectonic Therapeutic Inc. Common Stock
GROY,650100220.0,2.56,Gold Royalty Corp. Common Shares
TRON,649903428.0,1.37,Tron Inc. Common Stock
BSTZ,649445997.0,29.31,BlackRock Science and Technology Term Trust Common Shares of
MGRE,648928678.0,22.84,Affiliated Managers Group Inc. 6.750% Junior Subordinated No
BMM,648053346.0,6.18,Blue Moon Metals Inc. Common Shares
RMT,647536152.0,13.99,Royce Micro-Cap Trust Inc. Common Stock
CWH,647271717.0,6.29,Camping World Holdings Inc. Class A Common Stock
NEXN,646447926.0,9.86,Nexxen International Ltd. Ordinary Shares
VINP,646043218.0,9.88,Vinci Compass Investments Ltd. Class A Common Shares
CNNE,645925438.0,14.7,Cannae Holdings Inc. Common Stock
MAKO,645351448.0,7.37,Mako Mining Corp Common Stock
NPB,644951353.0,18.65,Northpointe Bancshares Inc. Common Stock
VLGEA,642731909.0,43.4,Village Super Market Inc. Class A Common Stock
PRME,642095038.0,3.56,Prime Medicine Inc. Common Stock
PUBM,638131286.0,13.74,PubMatic Inc. Class A Common Stock
RWT,636095944.0,5.08,Redwood Trust Inc. Common Stock
FISN,635489167.0,10.79,Deep Fission Inc. Common Stock
CARS,635197965.0,11.14,Cars.com Inc. Common Stock 
RMR,634615906.0,20.41,The RMR Group Inc. Class A Common Stock
NRDS,633971274.0,9.63,NerdWallet Inc. Class A Common Stock
MSBI,633399008.0,30.55,Midland States Bancorp Inc. Common Stock
NCDL,631660561.0,12.79,Nuveen Churchill Direct Lending Corp. Common Stock
NB,631148970.0,4.34,NioCorp Developments Ltd. Common Stock
IHRT,630305495.0,4.17,iHeartMedia Inc. Class A Common Stock
RRBI,630023713.0,95.68,Red River Bancshares Inc. Common Stock
RILYT,629764413.0,20.65,BRC Group Holdings Inc. 6.00% Senior Notes Due 2028
XFLT,629034415.0,17.73,XAI Floating Rate & Alternative Income Trust Common Shares o
LEGH,628547714.0,26.43,Legacy Housing Corporation Common Stock (TX)
TREE,626490508.0,44.9,LendingTree Inc. Common Stock
SMC,623382779.0,30.65,Summit Midstream Corporation Common Stock
BHB,622806269.0,37.2,Bar Harbor Bankshares Inc. Common Stock
CERS,622145664.0,3.1,Cerus Corporation Common Stock
HIFS,622037358.0,289.67,Hingham Institution for Savings Common Stock
GRNT,620570633.0,4.71,Granite Ridge Resources Inc. Common Stock
AXG,618974938.0,3.25,Solowin Holdings Class A Ordinary Share
FBIOP,618210252.0,18.61,Fortress Biotech Inc. 9.375% Series A Cumulative Redeemable 
CSV,617989091.0,38.94,Carriage Services Inc. Common Stock
RGR,617122312.0,38.7,Sturm Ruger & Company Inc. Common Stock
ACHV,616980933.0,6.01,Achieve Life Sciences Inc. Common Shares
KLC,615827155.0,5.2,KinderCare Learning Companies Inc. Common Stock
FDMT,613200459.0,11.73,4D Molecular Therapeutics Inc. Common Stock
ASPI,613149787.0,4.87,ASP Isotopes Inc. Common Stock
FBRT,612625552.0,7.96,Franklin BSP Realty Trust Inc. Common Stock
NDMO,612194584.0,10.29,Nuveen Dynamic Municipal Opportunities Fund Common Shares of
NFBK,611213974.0,14.63,Northfield Bancorp Inc. Common Stock (Delaware)
QH,610571281.0,6.25,Quhuo Limited American Depository Shares
NTGR,610339394.0,22.74,NETGEAR Inc. Common Stock
IIM,609950487.0,12.96,Invesco Value Municipal Income Trust Common Stock
ACNB,606799654.0,59.42,ACNB Corporation Common Stock
LAES,606747264.0,2.72,SEALSQ Corp Ordinary Shares
GSM,606362378.0,3.25,Ferroglobe PLC Ordinary Shares
KRNY,606282149.0,9.37,Kearny Financial Corp Common Stock
HTZ,606267884.0,1.92,Hertz Global Holdings Inc Common Stock
MDXG,606209125.0,4.07,MiMedx Group Inc Common Stock
NRIM,605168859.0,27.2,Northrim BanCorp Inc Common Stock
KRUS,605122582.0,49.8,Kura Sushi USA Inc. Class A Common Stock
KE,605070953.0,25.16,Kimball Electronics Inc. Common Stock
AGMB,603780174.0,12.26,AgomAb Therapeutics NV American Depositary Shares
GOOD,603151133.0,12.46,Gladstone Commercial Corporation Real Estate Investment Trus
PACK,603091369.0,7.05,Ranpak Holdings Corp Class A Common Stock
CLDT,600997367.0,12.87,Chatham Lodging Trust (REIT) Common Shares of Beneficial Int
BRBI,600134456.0,11.97,BRBI BR Partners S.A. ADSs
UHT,599980858.0,43.24,Universal Health Realty Income Trust Common Stock
BHFAM,599705273.0,10.44,Brighthouse Financial Inc. Depositary shares each representi
SMWB,599198854.0,6.89,Similarweb Ltd. Ordinary Shares
BWB,598098222.0,21.45,Bridgewater Bancshares Inc. Common Stock
NPCE,596981475.0,17.51,Neuropace Inc. Common Stock
ILPT,596655965.0,8.95,Industrial Logistics Properties Trust Common Shares of Benef
BTGO,595451565.0,5.13,BitGo Holdings Inc. Class A Common Stock
DNUT,594780000.0,3.45,Krispy Kreme Inc. Common Stock
IIIV,594242960.0,21.27,i3 Verticals Inc. Class A Common Stock
CTKB,594055900.0,4.6,Cytek Biosciences Inc. Common Stock
NVCT,593310531.0,18.82,Nuvectis Pharma Inc. Common Stock
HQWWW,593148541.0,11.5,Horizon Quantum Holdings Ltd. Warrant
NMCO,592079634.0,10.81,Nuveen Municipal Credit Opportunities Fund Common Shares
WHFCL,591769020.0,25.46,WhiteHorse Finance Inc. 7.875% Notes due 2028
ELA,590669079.0,22.75,Envela Corporation Common Stock
AGCC,590618160.0,15.84,Agencia Comercial Spirits Ltd Class A Ordinary Shares
TOI,589399390.0,5.89,The Oncology Institute Inc. Common Stock
IMSR,587410983.0,5.54,Terrestrial Energy Inc. Common Stock  
OBE,587198395.0,8.69,Obsidian Energy Ltd. Common Shares
NOAH,586031482.0,8.74,Noah Holdings Limited American Depositary Shares
PRTH,585545259.0,7.11,Priority Technology Holdings Inc. Common Stock
DC,583913110.0,4.36,Dakota Gold Corp. Common Stock
SFST,582627267.0,61.62,Southern First Bancshares Inc. Common Stock
AIOT,581674106.0,4.33,PowerFleet Inc. Common Stock
NRGV,581581695.0,3.26,Energy Vault Holdings Inc. Common Stock
HY,581304731.0,32.45,Hyster-Yale Inc. Class A common stock
CIVB,578608408.0,27.84,Civista Bancshares Inc. Common Stock
SCZM,578066869.0,6.25,Santacruz Silver Mining Ltd. Common Shares
WEAV,576850854.0,7.25,Weave Communications Inc. Common Stock
ALT,576615867.0,2.96,Altimmune Inc. Common Stock
FLGT,575112616.0,20.25,Fulgent Genetics Inc. Common Stock
RILYL,574382206.0,14.29,BRC Group Holdings Inc. Depositary Shares each representing 
CBNK,574249397.0,35.21,Capital Bancorp Inc. Common Stock
VGM,573231902.0,10.57,Invesco Trust for Investment Grade Municipals Common Stock (
EGY,572899100.0,5.5,VAALCO Energy Inc.  Common Stock
DNA,572888821.0,9.22,Ginkgo Bioworks Holdings Inc. Class A Common Stock
BME,572519793.0,42.94,Blackrock Health Sciences Trust
MGR,571650708.0,20.12,Affiliated Managers Group Inc. 5.875% Junior Subordinated No
UNTY,571528142.0,56.92,Unity Bancorp Inc. Common Stock
BWAY,570870951.0,14.26,BrainsWay Ltd. American Depositary Shares
RILYZ,570295134.0,18.7,BRC Group Holdings Inc. 5.25% Senior Notes due 2028
FET,569962100.0,50.42,Forum Energy Technologies Inc. Common Stock
RILYP,568754948.0,14.15,BRC Group Holdings Inc. Depositary Shares each representing 
OOMA,567759500.0,20.65,Ooma Inc. Common Stock
ASIX,567218117.0,21.04,AdvanSix Inc. Common Stock 
DDI,566891354.0,11.44,DoubleDown Interactive Co. Ltd. American Depository Shares
SLI,566500588.0,2.33,Standard Lithium Ltd. Common Shares
SPIR,566281746.0,14.08,Spire Global Inc. Class A Common Stock
OSPN,566102420.0,15.27,OneSpan Inc. Common Stock
BTBT,565688480.0,1.62,Bit Digital Inc. Ordinary Shares
MYGN,565272537.0,5.99,Myriad Genetics Inc. Common Stock
RFI,565094222.0,11.5,Cohen & Steers Total Return Realty Fund Inc. Common Stock
GLRE,562420042.0,16.96,Greenlight Capital Re Ltd. Class A Ordinary Shares
BWBBP,562407512.0,20.17,Bridgewater Bancshares Inc. Depositary Shares Each Represent
OXM,561552353.0,37.61,Oxford Industries Inc. Common Stock
MLR,558276127.0,48.99,Miller Industries Inc. Common Stock
ETD,557529287.0,21.91,Ethan Allen Interiors Inc. Common Stock
MEI,556907354.0,15.7,Methode Electronics Inc. Common Stock
GCBC,556052340.0,32.66,Greene County Bancorp Inc. Common Stock
ADUR,555803967.0,15.93,Aduro Clean Technologies Inc. Common Stock
IIIN,555207867.0,28.57,Insteel Industries Inc. Common Stock
VKQ,554185183.0,10.02,Invesco Municipal Trust Common Stock
NFGC,552771605.0,1.44,New Found Gold Corp Common Shares
CSHR,552159076.0,4.19,CoinShares PLC Ordinary Shares
CTNM,551822925.0,14.76,Contineum Therapeutics Inc. Class A Common Stock
QNC,550617872.0,2.51,Quantum eMotion Corp. Common Shares
ORN,548291821.0,13.54,Orion Group Holdings Inc. Common
FEIM,548047705.0,55.69,Frequency Electronics Inc. Common Stock
ADV,547499630.0,41.18,Advantage Solutions Inc. Class A Common Stock
EIKN,547341529.0,10.11,Eikon Therapeutics Inc. Common Stock
VITL,546317789.0,12.75,Vital Farms Inc. Common Stock
TATT,545811079.0,42.04,TAT Technologies Ltd. Ordinary Shares
ALIT,545703541.0,20.32,Alight Inc. Class A Common Stock
THM,545514131.0,2.08,International Tower Hill Mines Ltd. Ordinary Shares (Canada)
IQI,544174271.0,10.29,Invesco Quality Municipal Income Trust Common Stock
BBCP,544148149.0,10.8,Concrete Pumping Holdings Inc. Common Stock
BDN,542849516.0,3.12,Brandywine Realty Trust Common Stock
ACIC,541828045.0,11.18,American Coastal Insurance Corporation Common Stock
PKOH,541803099.0,37.63,Park-Ohio Holdings Corp. Common Stock
AIIO,540942899.0,3.88,Robo.ai Inc. Class B Ordinary Shares
XOMA,540142162.0,43.07,XOMA Royalty Corporation Common Stock
OLP,540031338.0,24.75,One Liberty Properties Inc. Common Stock
HUYA,538715243.0,2.41,HUYA Inc. American depositary shares each  representing one 
EVGO,538268811.0,1.72,EVgo Inc. Class A Common Stock
TMQ,538102665.0,3.12,Trilogy Metals Inc. Common Stock
HBCP,537965273.0,68.59,Home Bancorp Inc. Common Stock
METCB,537027035.0,8.08,Ramaco Resources Inc. Class B Common Stock
PSFE,536161512.0,8.42,Paysafe Limited Common Shares
CLB,536104412.0,11.63,Core Laboratories Inc. Common Stock
AHRT,535865319.0,7.05,AH Realty Trust Inc. Common Stock
XMAX,535213573.0,8.41,XMAX Inc. Common Stock
BSRR,534938626.0,40.9,Sierra Bancorp Common Stock
CTEV,534277707.0,31.34,Claritev Corporation Class A Common Stock
ANGO,533014004.0,12.9,AngioDynamics Inc. Common Stock
EBF,532908100.0,21.07,Ennis Inc. Common Stock
KIDS,532193076.0,20.72,OrthoPediatrics Corp. Common Stock
FBIZ,531541082.0,63.56,First Business Financial Services Inc. Common Stock
MLAB,529951382.0,95.92,Mesa Laboratories Inc. Common Stock
WNC,528558201.0,12.99,Wabash National Corporation Common Stock
ALTI,527630083.0,3.48,AlTi Global Inc. Class A Common Stock
NKLR,527089331.0,4.77,Terra Innovatum Global N.V. Ordinary shares
MSIF,525551204.0,11.59,MSC Income Fund Inc. Common Stock
FIP,524646184.0,4.44,FTAI Infrastructure Inc. Common Stock 
MBUU,524309315.0,26.7,Malibu Boats Inc. Class A Common Stock
MNRO,523385156.0,16.75,Monro Inc. Common Stock
GPRK,522759772.0,10.11,Geopark Ltd Common Shares
MSBIP,522183637.0,25.19,Midland States Bancorp Inc. Depositary Shares Each Represent
YEXT,521290203.0,5.2,Yext Inc. Common Stock
ITIC,520747057.0,275.82,Investors Title Company Common Stock
ARVN,520686068.0,8.07,Arvinas Inc. Common Stock
VCV,519851649.0,10.86,Invesco California Value Municipal Income Trust Common Stock
DDL,519700907.0,2.2,Dingdong (Cayman) Limited American Depositary Shares (each t
SPT,518410265.0,8.62,Sprout Social Inc Class A Common Stock
TYG,517193874.0,43.36,Tortoise Energy Infrastructure Corporation Common Stock
CHCT,516863735.0,18.09,Community Healthcare Trust Incorporated Common Stock
TLRY,515612505.0,4.42,Tilray Brands Inc. Common Stock 
WTI,515514724.0,3.46,W&T Offshore Inc. Common Stock
OIS,514653698.0,8.55,Oil States International Inc. Common Stock
GEMI,513543162.0,4.3,Gemini Space Station Inc. Class A Common Stock
MG,513203065.0,16.13,Mistras Group Inc Common Stock
TASK,512837948.0,5.6,TaskUs Inc. Class A Common Stock
URG,512558090.0,1.29,Ur Energy Inc Common Shares (Canada)
NGS,512124797.0,40.65,Natural Gas Services Group Inc. Common Stock
SD,510572138.0,13.83,SandRidge Energy Inc. Common Stock
HQL,510256935.0,19.87,abrdn Life Sciences Investors Shares of Beneficial Interest
PAYS,509301592.0,9.11,Paysign Inc. Common Stock
LOCO,507991325.0,16.68,El Pollo Loco Holdings Inc. Common Stock
OPTU,507439112.0,1.06,Optimum Communications Inc. Class A common stock
ESEA,506231944.0,71.75,Euroseas Ltd. Common Stock (Marshall Islands)
SLDP,506213307.0,2.25,Solid Power Inc. Class A Common Stock
AQST,505481401.0,4.03,Aquestive Therapeutics Inc. Common Stock
CLNE,505415535.0,2.29,Clean Energy Fuels Corp. Common Stock
CNCK,504428669.0,2.63,Coincheck Group N.V. Ordinary Shares
VALN,502893781.0,5.3,Valneva SE American Depositary Shares
ROMA,502724979.0,8.44,Roma Green Finance Limited Class A Ordinary Shares
CLPT,502484125.0,16.76,ClearPoint Neuro Inc. Common Stock
ETO,502214489.0,30.64,Eaton Vance Tax-Advantage Global Dividend Opp Common Stock
GUT,502049358.0,6.84,Gabelli Utility Trust (The) Common Stock
CYH,500958911.0,3.56,Community Health Systems Inc. Common Stock
TRC,499983393.0,18.52,Tejon Ranch Co Common Stock
YORW,498599268.0,30.76,York Water Company (The) Common Stock
PROK,498398383.0,1.65,ProKidney Corp. Class A Ordinary Shares
FTHY,498274001.0,13.55,First Trust High Yield Opportunities 2027 Term Fund Common S
GDYN,497993152.0,5.96,Grid Dynamics Holdings Inc. Class A Common Stock
NRC,497948298.0,22.09,NRC Health Common Stock
OBT,495220934.0,36.94,Orange County Bancorp Inc. Common Stock
KELYA,494035958.0,14.25,Kelly Services Inc. Class A Common Stock
CTGO,493877937.0,16.05,Contango Silver & Gold Inc. Common Stock
COFS,493726904.0,32.97,ChoiceOne Financial Services Inc. Common Stock
STTK,491905517.0,6.42,Shattuck Labs Inc. Common Stock
DCBO,490012824.0,19.07,Docebo Inc. Common Shares
STRZ,489569544.0,29.16,Starz Entertainment Corp. Common Shares
BTQ,489144209.0,3.45,BTQ Technologies Corp. Common Stock
ZURA,488763218.0,5.14,Zura Bio Limited Class A Ordinary Shares
CPS,487560099.0,27.46,Cooper-Standard Holdings Inc. Common Stock
XRN,485519739.0,36.69,Chiron Real Estate Inc. Common Stock
BSVN,485343295.0,50.98,Bank7 Corp. Common stock
KYTX,485297780.0,7.98,Kyverna Therapeutics Inc. Common Stock
CTRN,484547258.0,58.17,Citi Trends Inc. Common Stock
OCGN,484086254.0,1.43,Ocugen Inc. Common Stock
SFIX,483668728.0,3.62,Stitch Fix Inc. Class A Common Stock
RYAM,483534396.0,7.17,Rayonier Advanced Materials Inc. Common Stock
LWAY,483060480.0,31.61,Lifeway Foods Inc. Common Stock
OFIX,481826092.0,11.92,Orthofix Medical Inc. Common Stock (DE)
WRN,481727416.0,2.13,Western Copper and Gold Corporation Common Stock
PDLB,481218290.0,19.89,Ponce Financial Group Inc. Common Stock
BWMN,480849914.0,27.46,Bowman Consulting Group Ltd. Common Stock
VMD,480360129.0,12.53,Viemed Healthcare Inc. Common Shares
GRRR,477428553.0,17.2,Gorilla Technology Group Inc. Ordinary shares
IPI,477342721.0,35.53,Intrepid Potash Inc Common Stock
PACB,476773591.0,1.53,Pacific Biosciences of California Inc. Common Stock
FVR,475466068.0,20.99,FrontView REIT Inc. Common Stock
GAU,475409050.0,1.82,Galiano Gold Inc.
CLMB,473670684.0,25.47,Climb Global Solutions Inc. Common Stock
STRO,473086033.0,28.55,Sutro Biopharma Inc. Common Stock
GOGO,472658638.0,3.5,Gogo Inc. Common Stock
KREF,471000555.0,7.33,KKR Real Estate Finance Trust Inc. Common Stock
CMDB,469826571.0,19.43,Costamare Bulkers Holdings Limited Common Stock
CRNC,469501336.0,10.39,Cerence Inc. Common Stock
IDR,469473763.0,29.7,Idaho Strategic Resources Inc. Common Stock
MAGN,469338000.0,13.11,Magnera Corporation Common Stock
TWI,469271588.0,7.29,Titan International Inc. (DE) Common Stock
MGRB,469083160.0,16.51,Affiliated Managers Group Inc. 4.750% Junior Subordinated No
VREX,468573000.0,11.13,Varex Imaging Corporation Common Stock
JOUT,467066516.0,44.59,Johnson Outdoors Inc. Class A Common Stock
PRTA,466467342.0,8.91,Prothena Corporation plc Ordinary Shares
LXFR,465474810.0,17.09,Luxfer Holdings PLC Ordinary Shares
VSTM,464851550.0,5.29,Verastem Inc. Common Stock
BWFG,463799881.0,58.17,Bankwell Financial Group Inc. Common Stock
PANL,463464729.0,7.08,Pangaea Logistics Solutions Ltd. Common Shares
CWCO,462085487.0,28.88,Consolidated Water Co. Ltd. Ordinary Shares
IBEX,460050026.0,34.36,IBEX Limited Common Shares
MTW,460001771.0,12.81,Manitowoc Company Inc. (The) Common Stock
EVMN,459954610.0,12.77,Evommune Inc. Common Stock
FRPH,459415640.0,23.96,FRP Holdings Inc. Common Stock
ETB,459072014.0,15.63,Eaton Vance Tax-Managed Buy-Write Income Fund Eaton Vance Ta
RZLT,457870034.0,4.75,Rezolute Inc. Common Stock (NV)
RBB,457692373.0,27.02,RBB Bancorp Common Stock
ZKH,457687633.0,2.88,ZKH Group Limited American Depositary Shares each representi
BMRC,457116377.0,28.23,Bank of Marin Bancorp Common Stock
BLW,457104038.0,12.8,Blackrock Limited Duration Income Trust
BETR,456649717.0,24.2,Better Home & Finance Holding Company Class A Common Stock
CABA,456553429.0,2.8,Cabaletta Bio Inc. Common Stock
FCBM,456473253.0,12.77,First Carolina Financial Services Inc. Common Stock
OVID,455401849.0,2.44,Ovid Therapeutics Inc. Common Stock
ELMT,454794522.0,15.17,The Elmet Group Co. Common Stock
BNTC,454164295.0,13.22,Benitec Biopharma Inc. Common Stock
CBK,453786029.0,33.12,Commercial Bancgroup Inc. Common Stock
PCTTW,453621663.0,2.26,PureCycle Technologies Inc. Warrant
GMTL,453590657.0,11.69,Guardian Metal Resources PLC ADS
ALTO,452125868.0,5.83,Alto Ingredients Inc. Common Stock
WTBA,452096082.0,26.55,West Bancorporation Common Stock
SWMR,451997522.0,40.32,Swarmer Inc Common Stock
DCTH,451543143.0,13.08,Delcath Systems Inc. Common Stock
MOVE,450723043.0,15.58,Corvex Inc. Common Stock
CLFD,450218810.0,33.13,Clearfield Inc. Common Stock
DIN,449943157.0,35.47,Dine Brands Global Inc. Common Stock
AMCX,448941217.0,10.22,AMC Global Media Inc. Class A Common Stock
RMNI,446602000.0,4.83,Rimini Street Inc. (DE) Common Stock
GRVY,446119380.0,64.2,GRAVITY Co. Ltd. American Depository Shares
GLAD,445874217.0,19.73,Gladstone Capital Corporation Common Stock
REAX,445695766.0,2.04,The Real Brokerage Inc. Common Shares
ERII,444835585.0,8.63,Energy Recovery Inc. Common Stock
SERV,443735853.0,5.74,Serve Robotics Inc. Common Stock
RLGT,442559244.0,9.45,Radiant Logistics Inc. Common Stock
CBIO,441978118.0,16.03,Crescent Biopharma Inc. Common Stock
SGMT,441834179.0,7.16,Sagimet Biosciences Inc. Series A Common Stock
CCCC,441163216.0,3.99,C4 Therapeutics Inc. Common Stock
TENX,441113394.0,16.63,Tenax Therapeutics Inc. Common Stock
DDD,440841159.0,3.0,3D Systems Corporation Common Stock
FSTR,439892081.0,42.06,L.B. Foster Company Common Stock
WILC,439501281.0,31.55,G. Willi-Food International  Ltd. Ordinary Shares
GBFH,439464590.0,30.37,GBank Financial Holdings Inc. Common Stock
GOTU,438732989.0,1.84,Gaotu Techedu Inc. American Depositary Shares
SRTA,438689710.0,5.07,Strata Critical Medical Inc. Class A Common Stock
EVN,438679156.0,11.06,Eaton Vance Municipal Income Trust Common Stock
BLND,438231147.0,1.81,Blend Labs Inc. Class A Common Stock
MATV,436805617.0,7.92,Mativ Holdings Inc. Common Stock
CINT,435647365.0,3.38,CI&T Inc Class A Common Shares
FRBA,435327860.0,17.32,First Bank Common Stock
QUAD,435162374.0,8.44,Quad Graphics Inc Class A Common Stock
CDRO,435147087.0,9.57,Codere Online Luxembourg S.A. Ordinary Shares
ARQQ,435075965.0,18.06,Arqit Quantum Inc. Ordinary Shares
AIBZ,434864122.0,8.06,Bitzero Holdings Inc. Common Shares
PBFS,434831729.0,17.34,Pioneer Bancorp Inc. Common Stock
HNST,433819822.0,3.94,The Honest Company Inc. Common Stock
SLN,433368000.0,9.26,Silence Therapeutics Plc American Depository Share
NVEC,432757056.0,89.47,NVE Corporation Common Stock
PHOE,432218160.0,20.01,Phoenix Asia Holdings Limited Ordinary Shares
SI,432184630.0,20.84,Shoulder Innovations Inc. Common Stock
ECX,430597782.0,1.13,ECARX Holdings Inc. Class A Ordinary shares
BNED,430097463.0,12.41,Barnes & Noble Education Inc Common Stock
ITRG,429784780.0,2.12,Integra Resources Corp. Common Shares
ASMB,429259342.0,27.01,Assembly Biosciences Inc. Common Stock
BOC,428385933.0,14.09,Boston Omaha Corporation Class A Common Stock
CCRN,427599442.0,13.22,Cross Country Healthcare Inc. Common Stock $0.0001 Par Value
ASPN,427233270.0,5.16,Aspen Aerogels Inc. Common Stock
CBAN,427213717.0,20.19,Colony Bankcorp Inc. Common Stock
HTT,427029636.0,2.75,High Templar Tech Limited American depositary shares each re
NEWT,427011197.0,14.78,NewtekOne Inc. Common Stock
SGU,426841129.0,13.0,Star Group L.P. Common Stock
WAVE,426529022.0,9.13,Eco Wave Power Global AB (publ) American Depositary Shares
ACTG,426441018.0,4.42,Acacia Research Corporation (Acacia Tech) Common Stock
BBW,426085000.0,33.98,Build-A-Bear Workshop Inc. Common Stock
MFI,425496593.0,8.48,mF International Limited Class A Ordinary Shares
EOLS,422787501.0,6.42,Evolus Inc. Common Stock
TITN,422002480.0,18.11,Titan Machinery Inc. Common Stock
IMXI,421924778.0,14.02,International Money Express Inc. Common Stock
MRLN,421327487.0,4.37,Merlin Inc. Common Stock
SHOE,420981031.0,15.51,Shoe Station Group Inc. Common Stock
FPI,420469818.0,9.64,Farmland Partners Inc. Common Stock
MGRD,419904720.0,14.78,Affiliated Managers Group Inc. 4.200% Junior Subordinated No
PCB,419568460.0,29.48,PCB Bancorp Common Stock
BXC,419237619.0,53.87,Bluelinx Holdings Inc. Common Stock
EPRX,419072365.0,6.42,Eupraxia Pharmaceuticals Inc. Common Stock
EBS,418961924.0,8.12,Emergent BioSolutions Inc. Common Stock
BBBY,418666520.0,5.16,Bed Bath & Beyond Inc. Common Stock
VKI,417860648.0,9.41,Invesco Advantage Municipal Income Trust II Common Shares of
LRMR,415531748.0,4.0,Larimar Therapeutics Inc. Common Stock
NUAI,414786350.0,4.09,New Era Energy & Digital Inc. Common Stock
BRCB,414462082.0,8.28,Black Rock Coffee Bar Inc. Class A Common Stock
LSAK,413540547.0,4.82,Lesaka Technologies Inc. Common Stock
SOPH,413512508.0,5.76,SOPHiA GENETICS SA Ordinary Shares
DDT,413397415.0,26.47,Dillard's Capital Trust I
USNA,413202186.0,22.38,USANA Health Sciences Inc. Common Stock
HELP,412813959.0,6.66,Cybin Inc. Common Stock
PBYI,412794588.0,8.11,Puma Biotechnology Inc Common Stock
KMDA,412455300.0,7.15,Kamada Ltd. Ordinary Shares
NATH,411569591.0,100.52,Nathan's Famous Inc. Common Stock
RBBN,411284721.0,2.33,Ribbon Communications Inc. Common Stock
CZNC,411096066.0,22.95,Citizens & Northern Corp Common Stock
FMAO,410842730.0,29.84,Farmers & Merchants Bancorp Inc. Common Stock
RCKT,410021776.0,3.75,Rocket Pharmaceuticals Inc. Common Stock
ALLT,409975570.0,8.38,Allot Ltd. Ordinary Shares
AUTL,409879910.0,1.54,Autolus Therapeutics plc American Depositary Share
AVBC,409555500.0,20.4,Avidia Bancorp Inc. Common Stock
ISTR,408152180.0,29.59,Investar Holding Corporation Common Stock
WDH,407807717.0,1.14,Waterdrop Inc. American Depositary Shares (each representing
FVRR,407501502.0,11.34,Fiverr International Ltd. Ordinary Shares no par value
HVT,407373384.0,25.31,Haverty Furniture Companies Inc. Common Stock
CCAP,406779310.0,11.04,Crescent Capital BDC Inc. Common stock
MTLS,406677576.0,6.88,Materialise NV American Depositary Shares
PLBC,406590736.0,58.35,Plumas Bancorp
MRAM,405842387.0,17.31,Everspin Technologies Inc. Common Stock
