ticker,mcap_usd,price,name
GPRE,1141246885.0,16.28,Green Plains Inc. Common Stock
SAFT,1136718043.0,77.42,Safety Insurance Group Inc. Common Stock
QDEL,1135379967.0,16.65,QuidelOrtho Corporation Common Stock
SBET,1135253253.0,5.34,Sharplink Inc. Common Stock
MBC,1135223313.0,8.87,MasterBrand Inc. Common Stock
CGEM,1133900949.0,18.45,Cullinan Therapeutics Inc. Common Stock
ABX,1131883931.0,11.8,Abacus Global Management Inc. Class A Common Stock
CVLG,1131435956.0,44.95,Covenant Logistics Group Inc. Class A Common Stock
VYX,1127262692.0,8.18,NCR Voyix Corporation Common Stock
PZZA,1125906919.0,34.22,Papa John's International Inc. Common Stock
OPK,1125087461.0,1.49,OPKO Health Inc. Common Stock
AGBK,1124308392.0,7.03,AGI Inc Class A Common Shares
SVC,1122256869.0,8.67,Service Properties Trust Common Shares of Beneficial Interes
JBIO,1119975564.0,22.69,Jade Biosciences Inc. Common Stock
ORIC,1119542433.0,10.81,Oric Pharmaceuticals Inc. Common Stock
DRTS,1118603757.0,12.71,Alpha Tau Medical Ltd. Ordinary Shares
FINV,1116724629.0,4.73,FinVolution Group American Depositary Shares
DSL,1116355282.0,10.95,DoubleLine Income Solutions Fund Common Shares of Beneficial
CRTO,1114934083.0,22.25,Criteo S.A. American Depositary Shares
EDN,1113428310.0,24.61,Empresa Distribuidora Y Comercializadora Norte S.A. (Edenor)
LFMDP,1112337730.0,23.0,LifeMD Inc. 8.875% Series A Cumulative Perpetual Preferred S
JBGS,1109894758.0,14.89,JBG SMITH Properties Common Shares 
CNL,1109164504.0,11.96,Collective Mining Ltd. Common Shares
NHP,1105966969.0,15.17,National Healthcare Properties Inc. Class A Common Stock
SLDB,1105096827.0,11.22,Solid Biosciences Inc. Common Stock
BTZ,1104209739.0,10.21,BlackRock Credit Allocation Income Trust
DFIN,1103596416.0,44.17,Donnelley Financial Solutions Inc. Common Stock 
ENVX,1102765639.0,5.05,Enovix Corporation Common Stock
PSEC,1099661698.0,2.19,Prospect Capital Corporation Common Stock
UPWK,1098076238.0,8.89,Upwork Inc. Common Stock
DLX,1096986102.0,23.96,Deluxe Corporation Common Stock
GOODN,1096902461.0,22.66,Gladstone Commercial Corporation 6.625% Series E Cumulative 
APEI,1095748256.0,59.73,American Public Education Inc. Common Stock
ARHS,1091981594.0,7.71,Arhaus Inc. Class A Common Stock
CIM,1091580535.0,13.05,Chimera Investment Corporation Common Stock
OLMA,1090969913.0,12.49,Olema Pharmaceuticals Inc. Common Stock
NMAX,1090761647.0,8.45,Newsmax Inc. Class B Common Stock
GNK,1089208390.0,25.0,Genco Shipping & Trading Limited Ordinary Shares New (Marsha
ITRN,1088775633.0,54.73,Ituran Location and Control Ltd. Ordinary Shares
SBR,1088056517.0,74.63,Sabine Royalty Trust Common Stock
VOR,1088052410.0,20.08,Vor Biopharma Inc. Common Stock
EVLV,1086423316.0,6.04,Evolv Technologies Holdings Inc. Class A Common Stock
SIFY,1085070533.0,14.98,Sify Technologies Limited American Depositary Shares
ELVR,1084773523.0,64.05,Elevra Lithium Limited American Depository Shares
OCFC,1083457298.0,18.81,OceanFirst Financial Corp. Common Stock
ALVO,1080049947.0,3.46,Alvotech Ordinary Shares
BIOA,1077534272.0,24.24,BioAge Labs Inc. Common Stock
CBRL,1075664013.0,48.12,Cracker Barrel Old Country Store Inc Common Stock
BRUNW,1075001795.0,17.5,Boost Run Inc. Warrant
DEC,1070750259.0,13.95,Diversified Energy Company Common Stock
PTA,1069541393.0,19.35,Cohen & Steers Tax-Advantaged Preferred Securities and Incom
EVC,1069495272.0,11.62,Entravision Communications Corporation Common Stock
RZLV,1069046015.0,2.67,Rezolve AI PLC Ordinary Shares
AOSL,1068785230.0,35.71,Alpha and Omega Semiconductor Limited Common Shares
USPH,1068054612.0,70.18,U.S. Physical Therapy Inc. Common Stock
AIIR,1067372836.0,6.66,Air Global PLC Ordinary Shares
VMET,1066270862.0,9.88,Versamet Royalties Corporation Common Stock
CERT,1065617565.0,6.85,Certara Inc. Common Stock
MUX,1065042462.0,17.77,McEwen Inc. Common Stock
LUXE,1063719197.0,7.8,LuxExperience B.V. American Depositary Shares each represent
VZLA,1059226119.0,3.03,Vizsla Silver Corp. Common Shares
LWLG,1058837665.0,6.87,Lightwave Logic Inc. Common Stock
KURA,1057746559.0,11.91,Kura Oncology Inc. Common Stock
HTFC,1055346560.0,24.8,Horizon Technology Finance Corporation 6.25% Notes due 2027
FUBO,1051831877.0,9.7,FuboTV Inc. Class A Common Stock
TNDM,1051578871.0,15.35,Tandem Diabetes Care Inc. Common Stock
MSEX,1050598399.0,56.41,Middlesex Water Company Common Stock
NBN,1050314700.0,129.19,Northeast Bank Common Stock
BST,1049394829.0,47.36,BlackRock Science and Technology Trust Common Shares of Bene
OCSL,1049098579.0,11.91,Oaktree Specialty Lending Corporation Common Stock
SBGI,1048926720.0,14.54,Sinclair Inc. Class A Common Stock
HQH,1045822907.0,22.09,abrdn Healthcare Investors Shares of Beneficial Interest
CFFN,1044583374.0,8.24,Capitol Federal Financial Inc. Common Stock
BOW,1044577893.0,31.81,Bowhead Specialty Holdings Inc. Common Stock
VRTS,1043680635.0,156.19,Virtus Investment Partners Inc. Common Stock
THRM,1042687860.0,34.0,Gentherm Inc Common Stock
SCSC,1042648338.0,51.3,ScanSource Inc. Common Stock
AVTX,1039221358.0,19.77,Avalo Therapeutics Inc. Common Stock
ADTN,1038800633.0,12.82,ADTRAN Holdings Inc. Common Stock
ETW,1036795056.0,9.46,Eaton Vance Corporation Eaton Vance Tax-Managed Global Buy-W
ESQ,1036558931.0,119.98,Esquire Financial Holdings Inc. Common Stock
HEPS,1035953080.0,2.9,D-Market Electronic Services & Trading American Depositary S
ANNX,1035484840.0,6.32,Annexon Inc. Common Stock
PDS,1035428692.0,80.01,Precision Drilling Corporation Common Stock
FSBC,1032468190.0,48.3,Five Star Bancorp Common Stock
CRON,1030948857.0,2.74,Cronos Group Inc. Common Share
ELE,1028840819.0,15.98,Elemental Royalty Corporation Common Stock
DJTWW,1027498702.0,3.71,Trump Media & Technology Group Corp. Warrants
ROOT,1024752666.0,64.75,Root Inc. Class A Common Stock
MGRT,1024375000.0,74.5,Mega Fortune Company Limited Ordinary Shares
PHAR,1024065835.0,14.5,Pharming Group N.V. ADS each representing 10 ordinary shares
DCBG,1023736858.0,26.15,Dime Commercial Bancshares Inc. 9.000% Junior Subordinated N
MCBS,1019724294.0,35.58,MetroCity Bankshares Inc. Common Stock
FAC,1018861292.0,9.52,Factorial Energy Inc. Class A Common Stock
JBSS,1018395774.0,87.12,John B. Sanfilippo & Son Inc. Common Stock
UAMY,1018035223.0,6.87,United States Antimony Corporation Common Stock
DBVT,1017201841.0,17.18,DBV Technologies S.A. American Depositary Shares
CNMD,1016636935.0,33.77,CONMED Corporation Common Stock
LXRX,1014988751.0,2.29,Lexicon Pharmaceuticals Inc. Common Stock
GSBD,1014247294.0,9.01,Goldman Sachs BDC Inc. Common Stock
ETON,1014065093.0,37.02,Eton Pharmaceuticals Inc. Common Stock
ASM,1013120322.0,5.95,Avino Silver & Gold Mines Ltd. Common Shares (Canada)
SBSI,1011558174.0,34.0,Southside Bancshares Inc. Common Stock
KDK,1010961356.0,5.07,Kodiak AI Inc. Common Stock 
RNP,1010290192.0,20.56,Cohen & Steers REIT and Preferred and Income Fund Inc. Commo
ABUS,1009417698.0,5.11,Arbutus Biopharma Corporation Common Stock
ACEL,1009271960.0,12.4,Accel Entertainment Inc. 
PLOW,1007564615.0,43.57,Douglas Dynamics Inc. Common Stock
GO,1005548961.0,10.16,Grocery Outlet Holding Corp. Common Stock
ENHA,1004115197.0,2.63,Enhanced Group Inc. Class A Common Stock
GDRX,1002479104.0,2.96,GoodRx Holdings Inc. Class A Common Stock
PCRX,1002191624.0,25.47,Pacira BioSciences Inc. Common Stock
LUCK,1002123749.0,7.33,Lucky Strike Entertainment Corporation Class A Common Stock
CPAC,1002025016.0,11.82,Cementos Pacasmayo S.A.A. American Depositary Shares (Each r
LBRX,999381322.0,34.85,LB Pharmaceuticals Inc Common Stock
JCAP,998917868.0,18.02,Jefferson Capital Inc. Common Stock
NNE,996874247.0,19.14,Nano Nuclear Energy Inc. Common Stock
ARRY,995256666.0,6.47,Array Technologies Inc. Common Stock
VLRS,994637084.0,8.56,Controladora Vuela Compania de Aviacion S.A.B. de C.V. Ameri
EEX,993505504.0,5.02,Emerald Holding Inc. Common Stock
HBNC,992460987.0,19.34,Horizon Bancorp Inc. Common Stock
SCHL,991669769.0,45.61,Scholastic Corporation Common Stock
COUR,991447268.0,5.86,Coursera Inc. Common Stock
EQBK,991170160.0,48.02,Equity Bancshares Inc. Class A Common Stock
SPTX,987638648.0,18.45,Seaport Therapeutics Inc. Common Stock
UMAC,986428336.0,20.64,Unusual Machines Inc. Common Stock
PSUS,984678250.0,37.66,Pershing Square USA Ltd. Common Shares
IQ,984325230.0,1.02,iQIYI Inc. American Depositary Shares
JANX,984287474.0,16.14,Janux Therapeutics Inc. Common Stock
TROX,984263660.0,6.17,Tronox Holdings plc Ordinary Shares (UK)
PSF,982526867.0,20.0,Cohen & Steers Select Preferred and Income Fund Inc. Common 
BKSY,981904828.0,26.46,BlackSky Technology Inc. Class A Common Stock
BCX,981807176.0,11.57,BlackRock Resources Common Shares of Beneficial Interest
BLDP,981303888.0,3.25,Ballard Power Systems Inc. Common Shares
GRPN,981126203.0,25.83,Groupon Inc. Common Stock
CRAI,980410549.0,151.69,CRA International Inc. Common Stock
CSIQ,979951662.0,14.45,Canadian Solar Inc. Common Shares (ON)
CPF,978274063.0,37.48,Central Pacific Financial Corp New
INDI,977955111.0,4.31,indie Semiconductor Inc. Class A Common Stock
BFST,977398023.0,29.91,Business First Bancshares Inc. Common Stock
CCNE,977312994.0,32.98,CNB Financial Corporation Common Stock
AEF,976998750.0,9.1,abrdn Emerging Markets ex-China Fund Inc. Common Stock
MBWM,975915816.0,56.49,Mercantile Bank Corporation Common Stock
CRSR,975834586.0,9.13,Corsair Gaming Inc. Common Stock
WSR,975457683.0,18.98,Whitestone REIT Common Shares
FMN,974679805.0,11.3,Federated Hermes Premier Municipal Income Fund
FRBT,971391954.0,19.55,Forbright Inc. Class A Common Stock
FSCO,968968572.0,4.88,FS Credit Opportunities Corp. Common Stock
GOODO,968817558.0,20.01,Gladstone Commercial Corporation 6.00% Series G Cumulative R
BAK,966614499.0,2.42,Braskem SA ADR
IVA,964569497.0,4.62,Inventiva S.A. American Depository Shares
REPL,964529900.0,11.49,Replimune Group Inc. Common Stock
AMTB,963249988.0,25.04,Amerant Bancorp Inc. Class A Common Stock
RJET,962345732.0,20.55,Republic Airways Holdings Inc. Common Stock
ODD,958347827.0,16.91,ODDITY Tech Ltd. Class A Ordinary Shares
DAKT,957971305.0,19.84,Daktronics Inc. Common Stock
KFRC,953744520.0,53.48,Kforce Inc. Common Stock
GERN,952658646.0,1.49,Geron Corporation Common Stock
ABR,952187955.0,4.95,Arbor Realty Trust Common Stock
BLZE,951672000.0,15.86,Backblaze Inc. Class A Common Stock
MFA,950432750.0,9.36,MFA Financial Inc.
BVS,948955158.0,11.36,Bioventus Inc. Class A Common Stock
SIGIP,948931892.0,15.85,Selective Insurance Group Inc. Depositary Shares each repres
PDX,948906075.0,21.23,PIMCO Dynamic Income Strategy Fund Common Shares of Benefici
CSR,945681226.0,56.28,D/B/A Centerspace Common Stock
UTL,945237210.0,52.54,UNITIL Corporation Common Stock
TRST,945212527.0,54.09,TrustCo Bank Corp NY Common Stock
HSLV,943884660.0,4.64,Highlander Silver Corp. Common Shares
HAFC,942702996.0,31.67,Hanmi Financial Corporation Common Stock
AIZN,941568877.0,18.66,Assurant Inc. 5.25% Subordinated Notes due 2061
GENVR,939796812.0,1.56,Gen Digital Inc. Contingent Value Rights
EIG,938142212.0,51.42,Employers Holdings Inc Common Stock
TK,938075931.0,10.81,Teekay Corporation Ltd. Common Stock
BUR,936513609.0,4.28,Burford Capital Limited Ordinary Shares
ANRO,936306319.0,26.68,Alto Neuroscience Inc. Common Stock
AVR,935828471.0,9.61,Anteris Technologies Global Corp. Common Stock
ESRT,935433873.0,5.42,Empire State Realty Trust Inc. Class A Common Stock
ASA,934711345.0,51.31,ASA  Gold and Precious Metals Limited
GILT,934707691.0,12.38,Gilat Satellite Networks Ltd. Ordinary Shares
LMB,934611653.0,78.4,Limbach Holdings Inc. Common Stock
DSGN,931858052.0,14.92,Design Therapeutics Inc. Common Stock
PHAT,929555632.0,11.65,Phathom Pharmaceuticals Inc. Common Stock
BH,926261256.0,403.72,Biglari Holdings Inc. Class B Common Stock
QNST,926019364.0,16.12,QuinStreet Inc. Common Stock
BBSI,925775969.0,37.7,Barrett Business Services Inc. Common Stock
PMT,921449919.0,10.57,PennyMac Mortgage Investment Trust Common Shares of Benefici
NBBK,921394019.0,20.61,NB Bancorp Inc. Common Stock
ACDC,919982029.0,5.08,ProFrac Holding Corp. Class A Common Stock
RWAYL,919902453.0,25.4,Runway Growth Finance Corp. 7.50% Notes due 2027
MBINN,918708160.0,20.0,Merchants Bancorp Depositary Shares Preferred Series C
INMD,917358670.0,14.48,InMode Ltd. Ordinary Shares
GAINZ,916688232.0,23.98,Gladstone Investment Corporation 4.875% Notes due 2028
RDVT,915951151.0,64.92,Red Violet Inc. Common Stock 
NAK,914427816.0,1.63,Northern Dynasty Minerals Ltd. Common Stock
GOOS,914110379.0,9.41,Canada Goose Holdings Inc. Subordinate Voting Shares
GLIBA,913425313.0,22.89,Liberty Capital Corporation Series A GCI Group Common Stock
CRCT,912009565.0,4.34,Cricut Inc. Class A Common Stock
GLAS,910694091.0,11.59,Glass House Brands Inc. Subordinate Voting Shares
WRLD,910152953.0,196.14,World Acceptance Corporation Common Stock
TBN,908470601.0,32.08,Tamboran Resources Corporation Common stock
LYTS,907347065.0,24.71,LSI Industries Inc. Common Stock
AIAI,905644191.0,12.88,AIAI Holdings Corporation Class A Common Stock
AEBI,904032824.0,11.65,Aebi Schmidt Holding AG Common Stock 
KBDC,903687027.0,13.62,Kayne Anderson BDC Inc. Common Stock
GLIBK,902650964.0,22.62,Liberty Capital Corporation Series C GCI Group Common Stock
AIO,902137334.0,26.27,Virtus Artificial Intelligence & Technology Opportunities Fu
BHFAL,899888222.0,15.66,Brighthouse Financial Inc. 6.25% Junior Subordinated Debentu
CAC,899184389.0,53.16,Camden National Corporation Common Stock
SG,898337087.0,7.56,Sweetgreen Inc. Class A Common Stock
KOP,896876206.0,46.63,Koppers Holdings Inc. Common Stock
OFRM,896703463.0,21.4,Once Upon a Farm PBC Common Stock
BFS,893837154.0,36.43,Saul Centers Inc. Common Stock
LANDO,892711378.0,20.7,Gladstone Land Corporation 6.00% Series B Cumulative Redeema
HPK,892088214.0,7.06,HighPeak Energy Inc. Common Stock
TCBIO,891760574.0,20.42,Texas Capital Bancshares Inc. Depositary Shares 5.75% Fixed 
RERE,891312209.0,4.07,ATRenew Inc. American Depositary Shares (every three of whic
NPK,891144003.0,124.4,National Presto Industries Inc. Common Stock
BBDC,890008514.0,8.5,Barings BDC Inc. Common Stock
ASST,889415619.0,12.17,Strive Inc. Class A Common Stock
THFF,887135442.0,74.6,First Financial Corporation Common Stock
LANDP,886646376.0,20.55,Gladstone Land Corporation 6.00% Series C Cumulative Redeema
ARKO,886267196.0,7.9,ARKO Corp. Common Stock
TIGR,885895899.0,4.67,UP Fintech Holding Ltd American Depositary Share representin
MOMO,885745669.0,6.0,Hello Group Inc. American Depositary Shares
BANFP,883120460.0,26.29,BancFirst Corporation - BFC Capital Trust II Cumulative Trus
DGICB,882521543.0,23.82,Donegal Group Inc. Class B Common Stock
EVEX,881210598.0,2.53,Eve Holding Inc. Common Stock
SUPV,881017355.0,9.64,Grupo Supervielle S.A. American Depositary Shares each Repre
TBPH,877947675.0,17.03,Theravance Biopharma Inc. Ordinary Shares
BHFAO,877197137.0,15.27,Brighthouse Financial Inc. Depositary Shares 6.75% Non-Cumul
TALK,874415595.0,5.22,Talkspace Inc. Common Stock
EVER,872658768.0,24.67,EverQuote Inc. Class A Common Stock
ZVRA,870765187.0,14.73,Zevra Therapeutics Inc. Common Stock
MPB,868064264.0,34.25,Mid Penn Bancorp Common Stock
CAPL,866103314.0,22.7,CrossAmerica Partners LP Common Units representing limited p
IQMXW,864853803.0,4.5,IQM Quantum Computers Oyj Warrants to purchase American Depo
AMPH,863559819.0,19.59,Amphastar Pharmaceuticals Inc. Common Stock
MNTN,862880861.0,11.06,MNTN Inc. Class A Common Stock
AHG,860903436.0,1.56,Akso Health Group ADS
ADSE,859704489.0,11.94,ADS-TEC ENERGY PLC Ordinary Shares
HPP,859193660.0,15.84,Hudson Pacific Properties Inc. Common Stock
BZH,858692112.0,31.41,Beazer Homes USA Inc. Common Stock
HIVE,853077576.0,3.19,HIVE Digital Technologies Ltd. Common Shares
JMIA,852167835.0,6.88,Jumia Technologies AG American Depositary Shares each repres
MITK,851876565.0,18.86,Mitek Systems Inc. Common Stock
RUMBW,849963249.0,1.95,RUM Group Inc. Warrant
BHFAP,849651883.0,14.79,Brighthouse Financial Inc. Depositary Shares 6.6% Non-Cumula
GTM,848846882.0,2.88,ZoomInfo Technologies Inc Common Stock
WGO,847784101.0,29.99,Winnebago Industries Inc. Common Stock
ALOY,843956134.0,12.27,REalloys Inc. Common Stock
HSTM,843734629.0,28.88,HealthStream Inc. Common Stock
TDUP,841978616.0,6.52,ThredUp Inc. Class A Common Stock
NXDR,840959934.0,2.21,Nextdoor Holdings Inc. Class A Common Stock
MOV,839411454.0,37.77,Movado Group Inc. Common Stock
FMNB,839372923.0,14.18,Farmers National Banc Corp. Common Stock
MTAL,836165025.0,10.14,Metals Acquisition Corp. II Class A Ordinary Shares
HMH,834725983.0,18.97,HMH Holding Inc. Class A Common Stock
MATW,834041168.0,26.73,Matthews International Corporation Class A Common Stock
RPC,834036438.0,7.62,Ridgepost Capital Inc. Class A Common Stock
GSBC,833874690.0,76.55,Great Southern Bancorp Inc. Common Stock
MAX,833001638.0,13.36,MediaAlpha Inc. Class A Common Stock
PRME,829937187.0,4.59,Prime Medicine Inc. Common Stock
SMP,829529776.0,37.26,Standard Motor Products Inc. Common Stock
NABL,828864476.0,4.4,N-able Inc. Common Stock
CTMX,827271092.0,3.8,CytomX Therapeutics Inc. Common Stock
OIO,825299627.0,2.37,OIO Group Ordinary Shares
SOUNW,824426155.0,1.91,SoundHound AI Inc. Warrant
WOOF,822941107.0,2.54,Petco Health and Wellness Company Inc. Class A Common Stock
SMBC,822867710.0,74.7,Southern Missouri Bancorp Inc. Common Stock
CCBG,822748787.0,48.11,Capital City Bank Group Common Stock
PGC,822132739.0,46.4,Peapack-Gladstone Financial Corporation Common Stock
BCSF,820910956.0,12.65,Bain Capital Specialty Finance Inc. Common Stock
HRTG,820813722.0,27.05,Heritage Insurance Holdings Inc. Common Stock
ADAM,818634694.0,9.11,Adamas Trust Inc. Common Stock
HCMA,818578878.0,10.33,HCM III Acquisition Corp. Class A Ordinary Share
KELYB,818539576.0,23.61,Kelly Services Inc. Class B Common Stock
FCBC,818061369.0,43.36,First Community Bankshares Inc. (VA) Common Stock
ESPR,817346416.0,3.17,Esperion Therapeutics Inc. Common Stock
CCU,816970846.0,11.05,Compania Cervecerias Unidas S.A. Common Stock
DSP,814586650.0,12.43,Viant Technology Inc. Class A Common Stock
MFIC,813429702.0,9.88,MidCap Financial Investment Corporation Common Stock
FTK,812184493.0,22.45,Flotek Industries Inc. Common Stock
IMMX,812013817.0,11.63,Immix Biopharma Inc. Common Stock
TRNS,811473139.0,86.88,Transcat Inc. Common Stock
IPX,811127927.0,23.9,IperionX Limited American Depositary Share
HTB,810185924.0,48.21,HomeTrust Bancshares Inc. Common Stock
JKS,809643106.0,15.46,JinkoSolar Holding Company Limited American Depositary Share
YALA,807730211.0,5.32,Yalla Group Limited American Depositary Shares each represen
RGNX,806999864.0,15.61,REGENXBIO Inc. Common Stock
SPFI,806706345.0,42.13,South Plains Financial Inc. Common Stock
GMRS,805584670.0,14.91,GMR Solutions Inc. Class A Common Stock
INR,805583693.0,12.68,Infinity Natural Resources Inc. Class A Common Stock
EGBN,805084262.0,26.4,Eagle Bancorp Inc. Common Stock
OCS,804823999.0,13.88,Oculis Holding AG Ordinary shares
METC,803878959.0,12.1,Ramaco Resources Inc. Class A Common Stock
DQ,803197046.0,11.87,DAQO New Energy Corp. American Depositary Shares each repres
HDL,802468966.0,12.34,SUPER HI INTERNATIONAL HOLDING LTD. American Depositary Shar
LXU,800679345.0,11.13,LSB Industries Inc. Common Stock
APOG,799464343.0,38.31,Apogee Enterprises Inc. Common Stock
LPTH,798681257.0,12.72,LightPath Technologies Inc. Class A Common Stock
IRWD,798375019.0,4.85,Ironwood Pharmaceuticals Inc. Class A Common Stock
KODK,790098699.0,8.07,Eastman Kodak Company Common New
SMBK,787470174.0,46.05,SmartFinancial Inc. Common Stock
AGNT,787111596.0,4.79,AGNT Inc. Common Stock
WLKP,785983102.0,22.3,Westlake Chemical Partners LP Common Units representing limi
SABR,784696847.0,1.99,Sabre Corporation Common Stock
SPRY,784495770.0,7.9,ARS Pharmaceuticals Inc. Common Stock
HZO,782880593.0,35.54,MarineMax Inc.  (FL) Common Stock
PSIX,782447525.0,33.95,Power Solutions International Inc. Common Stock
ACRS,782116608.0,5.6,Aclaris Therapeutics Inc. Common Stock
SDHC,782060572.0,15.4,Smith Douglas Homes Corp. Class A Common Stock
ORRF,781000527.0,39.75,Orrstown Financial Services Inc. Common Stock
SKYH,780967669.0,10.21,Sky Harbour Group Corporation Class A Common Stock
OPFI,779640354.0,9.13,OppFi Inc. Class A Common Stock
PD,778937907.0,10.1,PagerDuty Inc. Common Stock
NGVC,778778567.0,33.8,Natural Grocers by Vitamin Cottage Inc. Common Stock
ONT,778077557.0,21.53,Onterris Inc. Common Stock
DJCO,777093761.0,564.04,Daily Journal Corp. (S.C.) Common Stock
RIGL,775607194.0,41.92,Rigel Pharmaceuticals Inc. Common Stock
MTUS,773860914.0,18.59,Metallus Inc. Common Shares
CLYM,773623441.0,13.51,Climb Bio Inc. Common Stock
NAVI,771575669.0,8.21,Navient Corporation Common Stock
PKE,771361730.0,36.95,Park Aerospace Corp. Common Stock
VTEX,770972807.0,4.05,VTEX Class A Common Shares
ALRS,770569930.0,30.66,Alerus Financial Corporation Common Stock
LOT,770507850.0,1.2,Lotus Technology Inc. American Depositary Shares
RSKD,767702501.0,5.18,Riskified Ltd. Class A Ordinary Shares
ANL,767210293.0,10.53,Adlai Nortye Ltd. American Depositary Shares
OMER,763921872.0,10.55,Omeros Corporation Common Stock
RILYN,762121679.0,24.99,BRC Group Holdings Inc. 6.50% Senior Notes Due 2026
GYRE,760353950.0,6.82,Gyre Therapeutics Inc. Common Stock
FWRG,759773208.0,12.32,First Watch Restaurant Group Inc. Common Stock
FPH,758850821.0,5.11,Five Point Holdings LLC Class A Common Shares
MITN,757969689.0,25.7,TPG Mortgage Investment Trust Inc. 9.500% Senior Notes due 2
MAMA,757831515.0,18.51,Mama's Creations Inc. Common Stock
ODTX,756493290.0,15.75,Odyssey Therapeutics Inc. Common Stock
MITP,755167855.0,25.61,TPG Mortgage Investment Trust Inc. 9.500% Senior Notes due 2
CYRX,755026649.0,14.98,CryoPort Inc. Common Stock
SOC,754005116.0,4.12,Sable Offshore Corp. Common Stock
CRESY,752516330.0,10.61,Cresud S.A.C.I.F. y A. American Depositary Shares
CODI,752359660.0,10.0,D/B/A Compass Diversified Holdings Shares of Beneficial Inte
IBTA,752014248.0,32.31,Ibotta Inc. Class A Common Stock
GDOT,748179498.0,13.2,Green Dot Corporation Class A Common Stock $0.001 par value
SIBN,747728911.0,16.86,SI-BONE Inc. Common Stock
NGNE,747044917.0,39.08,Neurogene Inc. Common Stock 
HNRG,746309757.0,15.84,Hallador Energy Company Common Stock
SHBI,744729024.0,22.26,Shore Bancshares Inc Common Stock
SSII,744489310.0,3.72,SS Innovations International Inc. Common Stock
EFOR,744489030.0,18.09,Everforth Inc. Common Stock
FISI,744341650.0,37.81,Financial Institutions Inc. Common Stock
AURA,744225013.0,7.2,Aura Biosciences Inc. Common Stock
EFSCP,742508912.0,20.3,Enterprise Financial Services Corporation Depositary Shares 
BBOT,742192319.0,9.27,BridgeBio Oncology Therapeutics Inc. Common Stock  
RILYG,741688645.0,24.32,BRC Group Holdings Inc. 5.00% Senior Notes due 2026
NX,739899516.0,16.11,Quanex Building Products Corporation Common Stock
ALLO,738630761.0,2.14,Allogene Therapeutics Inc. Common Stock
FDUS,737832836.0,19.44,Fidus Investment Corporation Common Stock
CCNEP,737762424.0,24.9,CNB Financial Corporation Depositary Shares each representin
RPD,734468492.0,10.99,Rapid7 Inc. Common Stock
HIPO,734212859.0,28.2,Hippo Holdings Inc. Common Stock
NXRT,732878871.0,28.75,NexPoint Residential Trust Inc. Common Stock
BBNX,732594266.0,16.44,Beta Bionics Inc. Common Stock
PAR,732532494.0,17.76,PAR Technology Corporation Common Stock
SATL,732325839.0,4.94,Satellogic Inc. Class A Common Stock
NIE,729854138.0,26.34,Virtus Equity & Convertible Income Fund Common Shares of Ben
CWBC,729231786.0,26.88,Community West Bancshares Common Stock
CBLL,728310127.0,19.2,CeriBell Inc. Common Stock
CGBD,726504769.0,10.36,Carlyle Secured Lending Inc. Common Stock
IVR,726342080.0,7.83,INVESCO MORTGAGE CAPITAL INC Common Stock
HYLN,725791867.0,4.07,Hyliion Holdings Corp. Class A Common Stock
IBCP,725748850.0,35.22,Independent Bank Corporation Common Stock
CTO,724995884.0,21.46,CTO Realty Growth Inc. Common Stock
KOPN,724364428.0,3.96,Kopin Corporation Common Stock
HOV,724011805.0,123.56,Hovnanian Enterprises Inc. Class A Common Stock
REPX,720739359.0,33.22,Riley Exploration Permian Inc. Common Stock
ODV,720666059.0,2.37,Osisko Development Corp. Common Shares
NEWTP,719216288.0,24.89,NewtekOne Inc. Depositary Shares Non-Cumulative Perpetual Pr
HQWWW,716936063.0,13.9,Horizon Quantum Holdings Ltd. Warrant
CSTL,715786867.0,23.6,Castle Biosciences Inc. Common Stock
PFLT,715271734.0,7.21,PennantPark Floating Rate Capital Ltd. Common Stock
GEGGL,715205751.0,24.66,Great Elm Group Inc.  7.25% Notes due 2027
SHEN,714339806.0,12.91,Shenandoah Telecommunications Co Common Stock
TXO,712904553.0,12.9,TXO Partners L.P. Common Units Representing Limited Partner 
CARE,712882081.0,32.08,Carter Bankshares Inc. Common Stock
SSYS,712646898.0,8.27,Stratasys Ltd. Ordinary Shares (Israel)
DGICA,711726579.0,19.21,Donegal Group Inc. Class A Common Stock
NEWP,710668243.0,3.84,New Pacific Metals Corp. Common Shares
WHK,710322686.0,27.35,WhiteHawk Minerals Corp Class A Common Stock
SGP,708118459.0,21.18,SpyGlass Pharma Inc. Common Stock
TBLD,705480607.0,21.99,Thornburg Income Builder Opportunities Trust Common Stock
GFR,704910980.0,5.62,Greenfire Resources Ltd. Common Shares
TRON,704457365.0,1.49,Tron Inc. Common Stock
CADL,704126997.0,9.61,Candel Therapeutics Inc. Common Stock
TECX,702688487.0,37.24,Tectonic Therapeutic Inc. Common Stock
INN,702205705.0,6.48,Summit Hotel Properties Inc. Common Stock
HSHP,701483750.0,15.01,Himalaya Shipping Ltd. Common Shares
BRSP,700244599.0,5.38,BrightSpire Capital Inc. Class A Common Stock
KRNT,698814393.0,15.08,Kornit Digital Ltd. Ordinary Shares
FOXF,697607572.0,16.64,Fox Factory Holding Corp. Common Stock
CRMD,697437311.0,8.89,CorMedix Inc. Common Stock
VBNK,695427055.0,21.6,VersaBank Common Shares
VEL,694818474.0,17.7,Velocity Financial Inc. Common Stock
TCMD,694281683.0,30.78,Tactile Systems Technology Inc. Common Stock
BHFAN,693370625.0,12.07,Brighthouse Financial Inc. Depositary shares each representi
